series,title,year,release,rated,runtime,action,adventure,thriller,documentary,crime,drama,fantasy,horror,scifi,war,comedy,family,mystery,romance,animation,music,biography,history,short,western,language,inEnglish,country,isUSA,awards,wins,nominations,imdbRating,metascore,rottenscore,imdbVote,imdbID,domestic,Domestic Lifetime,Foreign,Worldwide,Adj Factor,Adj Factor Lifetime,plot,title2,year2,release2,rated2,runtime2,action2,adventure2,thriller2,documentary2,crime2,drama2,fantasy2,horror2,scifi2,war2,comedy2,family2,mystery2,romance2,animation2,music2,biography2,history2,short2,western2,language2,inEnglish2,country2,isUSA2,awards2,wins2,nominations,imdbRating2,metascore2,rottenscore2,imdbVote2,imdbID2,production.budget2,domestic2,Domestic Lifetime2,Foreign2,Worldwide2,AdjFactor2,AdjFactor Lifetime2,plot2,yearDiff,ratedDiff,actionDiff,adventureDiff,crimeDiff,dramaDiff,thrillerDiff,fantasyDiff,horrorDiff,scifiDiff,warDiff,comedyDiff,familyDiff,mysteryDiff,animationDiff,musicDiff,biographyDiff,historyDiff,documentaryDiff,shortDiff,westernDiff,languageDiff,isEnglishDiff,countryDiff,isUSADiff,winsDiff,nominationDiff,metascoreDiff,imdbratingDiff,imdbvoteDiff,productionBudgetDiff,domesticDiff,foreignDiff,worldDiff,RateGr,RateGr2,Rev1,Rev2,ReleaseDiff,production.budget,seriesNo
21 Jump Street,21 Jump Street,2012,3/16/12,R,109,TRUE,FALSE,FALSE,FALSE,TRUE,FALSE,FALSE,FALSE,FALSE,FALSE,TRUE,FALSE,FALSE,FALSE,FALSE,FALSE,FALSE,FALSE,FALSE,FALSE,English,TRUE,USA,TRUE,11 wins & 20 nominations.,11,20,7.2,69,85,487194,tt1232829,144000000,1.44E+08,65456046,2.09E+08,1.03672,1.03672,A pair of underachieving cops are sent back to a local high school to blend in and bring down a synthetic drug ring.,22 Jump Street,2014,6/13/14,R,112,TRUE,FALSE,FALSE,FALSE,TRUE,FALSE,FALSE,FALSE,FALSE,FALSE,TRUE,FALSE,FALSE,FALSE,FALSE,FALSE,FALSE,FALSE,FALSE,FALSE,English,TRUE,USA,TRUE,7 wins & 24 nominations.,7,24,7,71,84,325994,tt2294449,50360882,193000000,1.93E+08,1.41E+08,3.34E+08,1.007218,1.007218,"After making their way through high school (twice), big changes are in store for officers Schmidt and Jenko when they go deep undercover at a local college.",2,TRUE,TRUE,TRUE,TRUE,TRUE,TRUE,TRUE,TRUE,TRUE,TRUE,TRUE,TRUE,TRUE,TRUE,TRUE,TRUE,TRUE,TRUE,TRUE,TRUE,TRUE,TRUE,TRUE,TRUE,31,6,2,-0.2,-161200,-43542087,-143999948,75543954,-208999882,"(6.7,7.5]","(6.7,7.5]","(1e+08,2e+08]","(1e+08,2e+08]",819,43542220,2
28 Days Later,28 Days Later...,2002,6/27/03,R,113,FALSE,FALSE,TRUE,FALSE,FALSE,TRUE,FALSE,TRUE,TRUE,FALSE,FALSE,FALSE,FALSE,FALSE,FALSE,FALSE,FALSE,FALSE,FALSE,FALSE,"English, Spanish",TRUE,UK,FALSE,10 wins & 31 nominations.,10,31,7.6,73,86,352515,tt0289043,62029700,62029700,51830265,1.14E+08,1.376452,1.376452,"Four weeks after a mysterious, incurable virus spreads throughout the UK, a handful of survivors try to find sanctuary.",28 Weeks Later,2007,5/11/07,R,100,FALSE,FALSE,TRUE,FALSE,FALSE,TRUE,FALSE,TRUE,TRUE,FALSE,FALSE,FALSE,FALSE,FALSE,FALSE,FALSE,FALSE,FALSE,FALSE,FALSE,English,TRUE,"UK, Spain",FALSE,2 wins & 13 nominations.,2,13,7,78,71,245828,tt0463854,-999,34549900,34549900,42947156,77497056,1.206397,1.206397,"Six months after the rage virus was inflicted on the population of Great Britain, the US Army helps to secure a small area of London for the survivors to repopulate and start again. But not everything goes according to plan.",5,TRUE,TRUE,TRUE,TRUE,TRUE,TRUE,TRUE,TRUE,TRUE,TRUE,TRUE,TRUE,TRUE,TRUE,TRUE,TRUE,TRUE,TRUE,TRUE,TRUE,FALSE,TRUE,FALSE,TRUE,12,-20,5,-0.6,-106687,-11011615,-62029558,-8883109,-113999774,"(7.5,10]","(6.7,7.5]","(0,1e+08]","(0,1e+08]",1414,11011617,2
300,300,2006,3/9/07,R,117,TRUE,FALSE,FALSE,FALSE,FALSE,TRUE,TRUE,FALSE,FALSE,TRUE,FALSE,FALSE,FALSE,FALSE,FALSE,FALSE,FALSE,FALSE,FALSE,FALSE,English,TRUE,"USA, Canada, Bulgaria",TRUE,17 wins & 45 nominations.,17,45,7.7,52,60,704212,tt0416449,254000000,2.54E+08,2.96E+08,5.50E+08,1.206395,1.206395,King Leonidas of Sparta and a force of 300 men fight the Persians at Thermopylae in 480 B.C.,300: Rise of an Empire,2014,3/7/14,R,102,TRUE,FALSE,FALSE,FALSE,FALSE,FALSE,FALSE,FALSE,FALSE,FALSE,FALSE,FALSE,FALSE,FALSE,FALSE,FALSE,FALSE,FALSE,FALSE,FALSE,English,TRUE,USA,TRUE,1 win & 6 nominations.,1,6,6.2,48,45,267413,tt1253863,114000000,111000000,1.11E+08,2.40E+08,3.51E+08,1.038483,1.038483,"Greek general Themistokles leads the charge against invading Persian forces led by mortal-turned-god Xerxes and Artemisia, vengeful commander of the Persian navy.",8,TRUE,TRUE,TRUE,TRUE,FALSE,TRUE,FALSE,TRUE,TRUE,FALSE,TRUE,TRUE,TRUE,TRUE,TRUE,TRUE,TRUE,TRUE,TRUE,TRUE,TRUE,TRUE,FALSE,TRUE,-11,12,-4,-1.5,-436799,-78415690,-253999992,-5.60E+07,-549999880,"(7.5,10]","(5.9,6.7]","(2e+08,3e+08]","(1e+08,2e+08]",2555,78415703,2
Alien,Alien,1979,6/22/79,R,117,FALSE,FALSE,FALSE,FALSE,FALSE,FALSE,FALSE,TRUE,TRUE,FALSE,FALSE,FALSE,FALSE,FALSE,FALSE,FALSE,FALSE,FALSE,FALSE,FALSE,English,TRUE,"UK, USA",TRUE,Won 1 Oscar. Another 16 wins & 19 nominations.,16,19,8.4,89,97,734400,tt0078748,261000000,2.68E+08,79362542,3.47E+08,3.306773,3.259383,"After a space merchant vessel perceives an unknown transmission as a distress call, its landing on the source moon finds one of the crew attacked by a mysterious lifeform, and they soon realize that its life cycle has merely begun.",Aliens,1986,7/18/86,R,137,TRUE,TRUE,FALSE,FALSE,FALSE,FALSE,FALSE,FALSE,TRUE,FALSE,FALSE,FALSE,FALSE,FALSE,FALSE,FALSE,FALSE,FALSE,FALSE,FALSE,English,TRUE,"USA, UK",TRUE,Won 2 Oscars. Another 18 wins & 22 nominations.,18,22,8.4,84,99,613004,tt0090605,-999,191000000,1.91E+08,1.03E+08,2.93E+08,2.237196,2.237196,"Ellen Ripley is rescued by a deep salvage team after being in hypersleep for 57 years. The moon that the Nostromo visited has been colonized, but contact is lost. This time, colonial marines have impressive firepower, but will that be enough?",7,TRUE,FALSE,FALSE,TRUE,TRUE,TRUE,TRUE,FALSE,TRUE,TRUE,TRUE,TRUE,TRUE,TRUE,TRUE,TRUE,TRUE,TRUE,TRUE,TRUE,TRUE,TRUE,FALSE,TRUE,1,6,-5,0,-121396,-36374496,-260999950,23637458,-346999900,"(7.5,10]","(7.5,10]","(2e+08,3e+08]","(1e+08,2e+08]",2583,36374498,2
Alien,Aliens,1986,7/18/86,R,137,TRUE,TRUE,TRUE,FALSE,FALSE,FALSE,FALSE,FALSE,TRUE,FALSE,FALSE,FALSE,FALSE,FALSE,FALSE,FALSE,FALSE,FALSE,FALSE,FALSE,English,TRUE,"USA, UK",TRUE,Won 2 Oscars. Another 18 wins & 22 nominations.,18,22,8.4,84,99,613004,tt0090605,191000000,1.91E+08,1.03E+08,2.93E+08,2.237196,2.237196,"Ellen Ripley is rescued by a deep salvage team after being in hypersleep for 57 years. The moon that the Nostromo visited has been colonized, but contact is lost. This time, colonial marines have impressive firepower, but will that be enough?",Alien³,1992,5/22/92,R,114,TRUE,FALSE,TRUE,FALSE,FALSE,FALSE,FALSE,TRUE,TRUE,FALSE,FALSE,FALSE,FALSE,FALSE,FALSE,FALSE,FALSE,FALSE,FALSE,FALSE,English,TRUE,USA,TRUE,Nominated for 1 Oscar. Another 5 wins & 23 nominations.,5,23,6.5,59,42,261679,tt0103644,100000000,111000000,1.11E+08,2.09E+08,3.20E+08,2,2,"After her last encounter, Ellen Ripley crash-lands on Fiorina 161, a maximum security prison. When a series of strange and deadly events occur shortly after her arrival, Ripley realizes that she has brought along an unwelcome visitor.",6,TRUE,TRUE,FALSE,TRUE,TRUE,TRUE,TRUE,FALSE,TRUE,TRUE,TRUE,TRUE,TRUE,TRUE,TRUE,TRUE,TRUE,TRUE,TRUE,TRUE,TRUE,TRUE,FALSE,TRUE,16,3,-25,-1.9,-351325,1002,-190999992,1.06E+08,-292999886,"(7.5,10]","(5.9,6.7]","(1e+08,2e+08]","(1e+08,2e+08]",2135,-999,3
Alien,Alien 3,1992,5/22/92,R,114,TRUE,FALSE,FALSE,FALSE,FALSE,FALSE,FALSE,TRUE,TRUE,FALSE,FALSE,FALSE,FALSE,FALSE,FALSE,FALSE,FALSE,FALSE,FALSE,FALSE,English,TRUE,USA,TRUE,Nominated for 1 Oscar. Another 5 wins & 23 nominations.,5,23,6.5,59,42,261679,tt0103644,111000000,1.11E+08,2.09E+08,3.20E+08,2,2,"After her last encounter, Ellen Ripley crash-lands on Fiorina 161, a maximum security prison. When a series of strange and deadly events occur shortly after her arrival, Ripley realizes that she has brought along an unwelcome visitor.",Alien Resurrection,1997,11/26/97,R,109,TRUE,FALSE,FALSE,FALSE,FALSE,FALSE,FALSE,TRUE,TRUE,FALSE,FALSE,FALSE,FALSE,FALSE,FALSE,FALSE,FALSE,FALSE,FALSE,FALSE,English,TRUE,USA,TRUE,6 wins & 18 nominations.,6,18,6.2,63,56,216236,tt0118583,136000000,86427900,86427900,2.05E+08,2.92E+08,1.808279,1.808279,"200 years after her death, Ellen Ripley is revived as a powerful human/alien hybrid clone. Along with a crew of space pirates, she must again battle the deadly aliens and stop them from reaching Earth.",5,TRUE,TRUE,TRUE,TRUE,TRUE,TRUE,TRUE,TRUE,TRUE,TRUE,TRUE,TRUE,TRUE,TRUE,TRUE,TRUE,TRUE,TRUE,TRUE,TRUE,TRUE,TRUE,TRUE,TRUE,-4,-4,4,-0.3,-45443,-99999976,-110999759,-4.00E+06,-319999901,"(5.9,6.7]","(5.9,6.7]","(1e+08,2e+08]","(0,1e+08]",2014,1.00E+08,4
Alien  vs Predator,Alien vs. Predator,2004,8/13/04,PG-13,101,TRUE,TRUE,TRUE,FALSE,FALSE,FALSE,FALSE,TRUE,TRUE,FALSE,FALSE,FALSE,FALSE,FALSE,FALSE,FALSE,FALSE,FALSE,FALSE,FALSE,"English, Italian",TRUE,"USA, UK, Czech Republic, Canada, Germany",TRUE,2 wins & 4 nominations.,2,4,5.6,29,20,177049,tt0370263,107000000,1.07E+08,1.23E+08,2.31E+08,1.336554,1.336554,"During an archaeological expedition on Bouvetøya Island in Antarctica, a team of archaeologists and other scientists find themselves caught up in a battle between the two legends. Soon, the team realize that only one species can win.",Aliens vs. Predator: Requiem,2007,12/25/07,R,94,TRUE,FALSE,TRUE,FALSE,FALSE,FALSE,FALSE,TRUE,TRUE,FALSE,FALSE,FALSE,FALSE,FALSE,FALSE,FALSE,FALSE,FALSE,FALSE,FALSE,English,TRUE,USA,TRUE,4 nominations.,0,4,4.7,29,11,111190,tt0758730,-999,49165300,49165300,1.02E+08,1.52E+08,1.176286,1.176286,"Warring Alien and Predator races descend on a rural Colorado town, where unsuspecting residents must band together for any chance of survival.",3,FALSE,TRUE,FALSE,TRUE,TRUE,TRUE,TRUE,TRUE,TRUE,TRUE,TRUE,TRUE,TRUE,TRUE,TRUE,TRUE,TRUE,TRUE,TRUE,TRUE,FALSE,TRUE,FALSE,TRUE,-15,0,0,-0.9,-65859,-80193210,-106999820,-2.10E+07,-230999955,"(5.1,5.9]","(0,5.1]","(1e+08,2e+08]","(0,1e+08]",1229,80193212,2
Alvin and the Chipmunks,Alvin and the Chipmunks,2007,12/14/07,PG,92,FALSE,FALSE,FALSE,FALSE,FALSE,FALSE,TRUE,FALSE,FALSE,FALSE,TRUE,TRUE,FALSE,FALSE,TRUE,TRUE,FALSE,FALSE,FALSE,FALSE,"English, French, Spanish, Japanese",TRUE,USA,TRUE,3 wins & 2 nominations.,3,2,5.2,39,28,71462,tt0952640,257000000,2.57E+08,1.70E+08,4.27E+08,1.182053,1.182053,Three musical chipmunks are discovered by an aspiring songwriter and wants to become famous by using their amazing singing abilities.,Alvin and the Chipmunks: The Squeakquel,2009,12/23/09,PG,88,FALSE,FALSE,FALSE,FALSE,FALSE,FALSE,TRUE,FALSE,FALSE,FALSE,TRUE,TRUE,FALSE,FALSE,TRUE,TRUE,FALSE,FALSE,FALSE,FALSE,"English, French",TRUE,USA,TRUE,3 wins.,3,0,4.5,41,20,40555,tt1231580,80227756,235000000,2.35E+08,2.39E+08,4.74E+08,1.069703,1.069703,"The world-famous singing preteen chipmunk trio return to contend with the pressures of school, celebrity, and a rival female music group known as The Chipettes.",2,TRUE,TRUE,TRUE,TRUE,TRUE,TRUE,TRUE,TRUE,TRUE,TRUE,TRUE,TRUE,TRUE,TRUE,TRUE,TRUE,TRUE,TRUE,TRUE,TRUE,FALSE,TRUE,TRUE,TRUE,-3,-16,2,-0.7,-30907,-70923010,-256999913,6.90E+07,-426999848,"(5.1,5.9]","(0,5.1]","(2e+08,3e+08]","(2e+08,3e+08]",740,70923180,2
Alvin and the Chipmunks,Alvin and the Chipmunks: The Squeakquel,2009,12/23/09,PG,88,FALSE,FALSE,FALSE,FALSE,FALSE,FALSE,TRUE,FALSE,FALSE,FALSE,TRUE,TRUE,FALSE,FALSE,TRUE,TRUE,FALSE,FALSE,FALSE,FALSE,"English, French",TRUE,USA,TRUE,3 wins.,3,0,4.5,41,20,40555,tt1231580,235000000,2.35E+08,2.39E+08,4.74E+08,1.069703,1.069703,"The world-famous singing preteen chipmunk trio return to contend with the pressures of school, celebrity, and a rival female music group known as The Chipettes.",Alvin and the Chipmunks: Chipwrecked,2011,12/16/11,G,87,FALSE,TRUE,FALSE,FALSE,FALSE,FALSE,TRUE,FALSE,FALSE,FALSE,TRUE,TRUE,FALSE,FALSE,TRUE,TRUE,FALSE,FALSE,FALSE,FALSE,English,TRUE,USA,TRUE,2 wins & 1 nomination.,2,1,4.3,24,12,29103,tt1615918,79102669,140000000,1.40E+08,2.21E+08,3.61E+08,1.054702,1.054702,"Playing around while aboard a cruise ship, the Chipmunks and Chipettes accidentally go overboard and end up marooned in a tropical paradise. They discover their new turf is not as deserted as it seems.",2,FALSE,TRUE,FALSE,TRUE,TRUE,TRUE,TRUE,TRUE,TRUE,TRUE,TRUE,TRUE,TRUE,TRUE,TRUE,TRUE,TRUE,TRUE,TRUE,TRUE,FALSE,TRUE,TRUE,TRUE,-12,1,-17,-0.2,-11452,-80227587,-234999978,-1.80E+07,-473999876,"(0,5.1]","(0,5.1]","(2e+08,3e+08]","(1e+08,2e+08]",723,80227756,3
Alvin and the Chipmunks,Alvin and the Chipmunks: Chipwrecked,2011,12/16/11,G,87,FALSE,TRUE,FALSE,FALSE,FALSE,FALSE,TRUE,FALSE,FALSE,FALSE,TRUE,TRUE,FALSE,FALSE,TRUE,TRUE,FALSE,FALSE,FALSE,FALSE,English,TRUE,USA,TRUE,2 wins & 1 nomination.,2,1,4.3,24,12,29103,tt1615918,140000000,1.40E+08,2.21E+08,3.61E+08,1.054702,1.054702,"Playing around while aboard a cruise ship, the Chipmunks and Chipettes accidentally go overboard and end up marooned in a tropical paradise. They discover their new turf is not as deserted as it seems.",Alvin and the Chipmunks: The Road Chip,2015,12/18/15,PG,92,FALSE,TRUE,FALSE,FALSE,FALSE,FALSE,TRUE,FALSE,FALSE,FALSE,TRUE,TRUE,FALSE,FALSE,TRUE,TRUE,FALSE,FALSE,FALSE,FALSE,"English, Spanish",TRUE,USA,TRUE,1 win & 4 nominations.,1,4,5,33,15,15098,tt2974918,-999,85886987,,148911649,234798636,,,"Through a series of misunderstandings, Alvin, Simon and Theodore come to believe that Dave is going to propose to his new girlfriend in Miami...and dump them. They have three days to get to him and stop the proposal, saving themselves not only from losing Dave but possibly from gaining a terrible stepbrother.",4,FALSE,TRUE,TRUE,TRUE,TRUE,TRUE,TRUE,TRUE,TRUE,TRUE,TRUE,TRUE,TRUE,TRUE,TRUE,TRUE,TRUE,TRUE,TRUE,TRUE,FALSE,TRUE,TRUE,TRUE,-14,35,9,0.7,-14005,-79102668,-139999999,,-360999999,"(0,5.1]","(0,5.1]","(1e+08,2e+08]","(0,1e+08]",1463,79102669,4
American Pie,American Pie,1999,7/9/99,R,95,FALSE,FALSE,FALSE,FALSE,FALSE,FALSE,FALSE,FALSE,FALSE,FALSE,TRUE,FALSE,FALSE,FALSE,FALSE,FALSE,FALSE,FALSE,FALSE,FALSE,English,TRUE,USA,TRUE,9 wins & 14 nominations.,9,14,7,58,61,358085,tt0163651,168000000,1.68E+08,2.17E+08,3.85E+08,1.633858,1.633858,Four teenage boys enter a pact to lose their virginity by prom night.,American Pie 2,2001,8/10/01,R,108,FALSE,FALSE,FALSE,FALSE,FALSE,FALSE,FALSE,FALSE,FALSE,FALSE,TRUE,FALSE,FALSE,FALSE,FALSE,FALSE,FALSE,FALSE,FALSE,FALSE,English,TRUE,USA,TRUE,8 wins & 6 nominations.,8,6,6.4,43,52,229287,tt0252866,43992928,213000000,2.13E+08,2.09E+08,4.22E+08,1.466431,1.466431,"Jim and his friends are now in college, and they decide to meet up at the beach house for some fun.",2,TRUE,TRUE,TRUE,TRUE,TRUE,TRUE,TRUE,TRUE,TRUE,TRUE,TRUE,TRUE,TRUE,TRUE,TRUE,TRUE,TRUE,TRUE,TRUE,TRUE,TRUE,TRUE,TRUE,TRUE,-10,45,-15,-0.6,-128798,-17972306,-167999925,-8.00E+06,-384999857,"(6.7,7.5]","(5.9,6.7]","(1e+08,2e+08]","(2e+08,3e+08]",763,17972436,2
American Pie,American Pie 2,2001,8/10/01,R,108,FALSE,FALSE,FALSE,FALSE,FALSE,FALSE,FALSE,FALSE,FALSE,FALSE,TRUE,FALSE,FALSE,FALSE,FALSE,FALSE,FALSE,FALSE,FALSE,FALSE,English,TRUE,USA,TRUE,8 wins & 6 nominations.,8,6,6.4,43,52,229287,tt0252866,213000000,2.13E+08,2.09E+08,4.22E+08,1.466431,1.466431,"Jim and his friends are now in college, and they decide to meet up at the beach house for some fun.",American Wedding,2003,8/1/03,R,96,FALSE,FALSE,FALSE,FALSE,FALSE,FALSE,FALSE,FALSE,FALSE,FALSE,TRUE,FALSE,FALSE,FALSE,FALSE,FALSE,FALSE,FALSE,FALSE,FALSE,English,TRUE,"USA, Germany",TRUE,3 wins & 6 nominations.,3,6,6.3,43,54,185528,tt0328828,75704828,144000000,1.44E+08,1.75E+08,3.19E+08,1.376451,1.376451,"It's the wedding of Jim and Michelle and the gathering of their families and friends, including Jim's old friends from high school and Michelle's little sister.",2,TRUE,TRUE,TRUE,TRUE,TRUE,TRUE,TRUE,TRUE,TRUE,TRUE,TRUE,TRUE,TRUE,TRUE,TRUE,TRUE,TRUE,TRUE,TRUE,TRUE,TRUE,TRUE,FALSE,TRUE,-21,1,0,-0.1,-43759,-43992763,-212999975,-3.40E+07,-421999887,"(5.9,6.7]","(5.9,6.7]","(2e+08,3e+08]","(1e+08,2e+08]",721,43992928,3
American Pie,American Wedding,2003,8/1/03,R,96,FALSE,FALSE,FALSE,FALSE,FALSE,FALSE,FALSE,FALSE,FALSE,FALSE,TRUE,FALSE,FALSE,FALSE,FALSE,FALSE,FALSE,FALSE,FALSE,FALSE,English,TRUE,"USA, Germany",TRUE,3 wins & 6 nominations.,3,6,6.3,43,54,185528,tt0328828,144000000,1.44E+08,1.75E+08,3.19E+08,1.376451,1.376451,"It's the wedding of Jim and Michelle and the gathering of their families and friends, including Jim's old friends from high school and Michelle's little sister.",American Reunion,2012,4/6/12,R,113,FALSE,FALSE,FALSE,FALSE,FALSE,FALSE,FALSE,FALSE,FALSE,FALSE,TRUE,FALSE,FALSE,FALSE,FALSE,FALSE,FALSE,FALSE,FALSE,FALSE,English,TRUE,USA,TRUE,1 win & 4 nominations.,1,4,6.7,49,45,195035,tt1605630,51108354,58275300,58275300,1.82E+08,2.40E+08,1.022167,1.022167,"Jim, Michelle, Stifler, and their friends reunite in East Great Falls, Michigan for their high school reunion.",9,TRUE,TRUE,TRUE,TRUE,TRUE,TRUE,TRUE,TRUE,TRUE,TRUE,TRUE,TRUE,TRUE,TRUE,TRUE,TRUE,TRUE,TRUE,TRUE,TRUE,TRUE,TRUE,FALSE,TRUE,-25,-17,6,0.4,9507,-75704692,-143999798,7.00E+06,-318999910,"(5.9,6.7]","(5.9,6.7]","(1e+08,2e+08]","(0,1e+08]",3171,75704828,4
Anaconda,Anaconda,1997,4/11/97,PG-13,89,TRUE,TRUE,TRUE,FALSE,FALSE,FALSE,FALSE,TRUE,FALSE,FALSE,FALSE,FALSE,FALSE,FALSE,FALSE,FALSE,FALSE,FALSE,FALSE,FALSE,English,TRUE,USA,TRUE,6 wins & 10 nominations.,6,10,4.8,37,40,89610,tt0118615,119000000,1.19E+08,1.28E+08,2.48E+08,1.808278,1.808278,"A """"""""National Geographic"""""""" film crew is taken hostage by an insane hunter, who forces them along on his quest to capture the world's largest - and deadliest - snake.",Anacondas: The Hunt for the Blood Orchid,2004,8/27/04,PG-13,97,TRUE,TRUE,TRUE,FALSE,FALSE,FALSE,FALSE,TRUE,FALSE,FALSE,FALSE,FALSE,FALSE,FALSE,FALSE,FALSE,FALSE,FALSE,FALSE,FALSE,"English, Indonesian",TRUE,USA,TRUE,2 nominations.,0,2,4.6,40,25,27062,tt0366174,26731104,43089100,43089100,51796827,94885927,1.336555,1.336555,"A scientific expedition sets out for Borneo to seek a flower called the Blood Orchid, which could grant longer life. Meanwhile, they run afoul of snakes and each other.",7,TRUE,TRUE,TRUE,TRUE,TRUE,TRUE,TRUE,TRUE,TRUE,TRUE,TRUE,TRUE,TRUE,TRUE,TRUE,TRUE,TRUE,TRUE,TRUE,TRUE,FALSE,TRUE,TRUE,TRUE,-41,16,3,-0.2,-62548,1102,-118999828,-76203173,-247999746,"(0,5.1]","(0,5.1]","(1e+08,2e+08]","(0,1e+08]",2695,-999,2
Austin Powers,Austin Powers: International Man of Mystery,1997,5/2/97,PG-13,89,FALSE,TRUE,FALSE,FALSE,FALSE,FALSE,FALSE,FALSE,FALSE,FALSE,TRUE,FALSE,FALSE,FALSE,FALSE,FALSE,FALSE,FALSE,FALSE,FALSE,English,TRUE,USA,TRUE,3 wins & 6 nominations.,3,6,7,51,70,210656,tt0118655,97437300,97437300,24954254,1.22E+08,1.808279,1.808279,"A 1960s secret agent is brought out of cryofreeze to oppose his greatest enemy in the 1990s, where his social attitudes are glaringly out of place.",Austin Powers: The Spy Who Shagged Me,1999,6/11/99,PG-13,95,TRUE,TRUE,FALSE,FALSE,TRUE,FALSE,FALSE,FALSE,FALSE,FALSE,TRUE,FALSE,FALSE,FALSE,FALSE,FALSE,FALSE,FALSE,FALSE,FALSE,"English, German",TRUE,USA,TRUE,Nominated for 1 Oscar. Another 18 wins & 29 nominations.,18,29,6.6,59,52,207552,tt0145660,53917323,337000000,3.37E+08,1.73E+08,5.10E+08,1.633858,1.633858,"Dr. Evil is back and has invented a new time machine that allows him to go back to the 1960s and steal Austin Powers' mojo, inadvertently leaving him """"""""shagless"""""""".",2,TRUE,FALSE,TRUE,FALSE,TRUE,TRUE,TRUE,TRUE,TRUE,TRUE,TRUE,TRUE,TRUE,TRUE,TRUE,TRUE,TRUE,TRUE,TRUE,TRUE,FALSE,TRUE,TRUE,TRUE,-14,-27,8,-0.4,-3104,-29836464,-97437174,148045746,-121999836,"(6.7,7.5]","(5.9,6.7]","(0,1e+08]","(3e+08,4e+08]",770,29836608,2
Austin Powers,Austin Powers: The Spy Who Shagged Me,1999,6/11/99,PG-13,95,TRUE,TRUE,FALSE,FALSE,TRUE,FALSE,FALSE,FALSE,FALSE,FALSE,TRUE,FALSE,FALSE,FALSE,FALSE,FALSE,FALSE,FALSE,FALSE,FALSE,"English, German",TRUE,USA,TRUE,Nominated for 1 Oscar. Another 18 wins & 29 nominations.,18,29,6.6,59,52,207552,tt0145660,337000000,3.37E+08,1.73E+08,5.10E+08,1.633858,1.633858,"Dr. Evil is back and has invented a new time machine that allows him to go back to the 1960s and steal Austin Powers' mojo, inadvertently leaving him """"""""shagless"""""""".",Austin Powers in Goldmember,2002,7/26/02,PG-13,94,TRUE,TRUE,FALSE,FALSE,TRUE,FALSE,FALSE,FALSE,FALSE,FALSE,TRUE,FALSE,FALSE,FALSE,FALSE,FALSE,FALSE,FALSE,FALSE,FALSE,"English, Japanese, German, French",TRUE,USA,TRUE,5 wins & 21 nominations.,5,21,6.2,62,54,186919,tt0295178,90000013,305000000,3.05E+08,1.19E+08,4.24E+08,1.428572,1.428572,"Upon learning that his father has been kidnapped, Austin Powers must travel to 1975 and defeat the aptly named villain Goldmember, who is working with Dr. Evil.",3,TRUE,TRUE,TRUE,TRUE,TRUE,TRUE,TRUE,TRUE,TRUE,TRUE,TRUE,TRUE,TRUE,TRUE,TRUE,TRUE,TRUE,TRUE,TRUE,TRUE,FALSE,TRUE,TRUE,TRUE,16,-6,3,-0.4,-20633,-53917145,-336999882,-5.40E+07,-509999856,"(5.9,6.7]","(5.9,6.7]","(3e+08,4e+08]","(3e+08,4e+08]",1141,53917323,3
Avengers,The Avengers,2012,5/4/12,PG-13,143,TRUE,TRUE,FALSE,FALSE,FALSE,FALSE,FALSE,FALSE,TRUE,FALSE,FALSE,FALSE,FALSE,FALSE,FALSE,FALSE,FALSE,FALSE,FALSE,FALSE,"English, Russian, Hindi",TRUE,USA,TRUE,Nominated for 1 Oscar. Another 38 wins & 79 nominations.,38,79,8,69,91,1208826,tt0848228,623357910,,895455078,1518812988,,,Earth's mightiest heroes must come together and learn to fight as a team if they are going to stop the mischievous Loki and his alien army from enslaving humanity.,Avengers: Age of Ultron,2015,5/1/15,PG-13,141,TRUE,TRUE,FALSE,FALSE,FALSE,FALSE,FALSE,FALSE,TRUE,FALSE,FALSE,FALSE,FALSE,FALSE,FALSE,FALSE,FALSE,FALSE,FALSE,FALSE,"English, Korean",TRUE,USA,TRUE,7 wins & 45 nominations.,7,45,7.3,66,75,688839,tt2395427,250000000,459005868,,943800000,1402805868,,,"When Tony Stark and Bruce Banner try to jump-start a dormant peacekeeping program called Ultron, things go horribly wrong and it's up to Earth's mightiest heroes to stop the villainous Ultron from enacting his terrible plan.",3,TRUE,TRUE,TRUE,TRUE,TRUE,TRUE,TRUE,TRUE,TRUE,TRUE,TRUE,TRUE,TRUE,TRUE,TRUE,TRUE,TRUE,TRUE,TRUE,TRUE,FALSE,TRUE,TRUE,TRUE,1,-19,-3,-0.7,-519987,,,,,"(7.5,10]","(6.7,7.5]","(4e+08,1e+10]","(4e+08,1e+10]",1092,2.20E+08,2
Avengers,Avengers: Age of Ultron,2015,5/1/15,PG-13,141,TRUE,TRUE,FALSE,FALSE,FALSE,FALSE,FALSE,FALSE,TRUE,FALSE,FALSE,FALSE,FALSE,FALSE,FALSE,FALSE,FALSE,FALSE,FALSE,FALSE,"English, Korean",TRUE,USA,TRUE,7 wins & 45 nominations.,7,45,7.3,66,75,688839,tt2395427,459005868,,943800000,1402805868,,,"When Tony Stark and Bruce Banner try to jump-start a dormant peacekeeping program called Ultron, things go horribly wrong and it's up to Earth's mightiest heroes to stop the villainous Ultron from enacting his terrible plan.",Avengers: Infinity War,2018,4/27/18,PG-13,149,TRUE,TRUE,FALSE,FALSE,FALSE,FALSE,FALSE,FALSE,TRUE,FALSE,FALSE,FALSE,FALSE,FALSE,FALSE,FALSE,FALSE,FALSE,FALSE,FALSE,English,TRUE,USA,TRUE,N/A,N/A,N/A,8.5,68,85,725561,tt4154756,-999,678815482,,1369544272,2048359754,,,The Avengers and their allies must be willing to sacrifice all in an attempt to defeat the powerful Thanos before his blitz of devastation and ruin puts an end to the universe.,3,TRUE,TRUE,TRUE,TRUE,TRUE,TRUE,TRUE,TRUE,TRUE,TRUE,TRUE,TRUE,TRUE,TRUE,TRUE,TRUE,TRUE,TRUE,TRUE,TRUE,FALSE,TRUE,TRUE,TRUE,-6,26,2,1.2,36722,,,,,"(6.7,7.5]","(7.5,10]","(4e+08,1e+10]","(4e+08,1e+10]",1092,2.50E+08,3
Avengers,Avengers: Infinity War,2018,4/27/18,PG-13,149,TRUE,TRUE,FALSE,FALSE,FALSE,FALSE,FALSE,FALSE,TRUE,FALSE,FALSE,FALSE,FALSE,FALSE,FALSE,FALSE,FALSE,FALSE,FALSE,FALSE,English,TRUE,USA,TRUE,N/A,N/A,N/A,8.5,68,85,725561,tt4154756,678815482,,1369544272,2048359754,,,The Avengers and their allies must be willing to sacrifice all in an attempt to defeat the powerful Thanos before his blitz of devastation and ruin puts an end to the universe.,Avengers: Endgame,2019,4/26/19,PG-13,181,TRUE,TRUE,FALSE,FALSE,FALSE,TRUE,FALSE,FALSE,TRUE,FALSE,FALSE,FALSE,FALSE,FALSE,FALSE,FALSE,FALSE,FALSE,FALSE,FALSE,"English, Japanese, Xhosa, German",TRUE,USA,TRUE,N/A,N/A,N/A,8.5,78,94,613329,tt4154796,356000000,858373000,,1939427564,2797800564,,,"After the devastating events of Avengers: Infinity War (2018), the universe is in ruins. With the help of remaining allies, the Avengers assemble once more in order to reverse Thanos' actions and restore balance to the universe.",1,TRUE,TRUE,TRUE,TRUE,FALSE,TRUE,TRUE,TRUE,TRUE,TRUE,TRUE,TRUE,TRUE,TRUE,TRUE,TRUE,TRUE,TRUE,TRUE,TRUE,FALSE,TRUE,TRUE,TRUE,-9,-1,10,0,-112232,,,,,"(7.5,10]","(7.5,10]","(4e+08,1e+10]","(4e+08,1e+10]",364,-999,4
Back to the Future,Back to the Future,1985,7/3/85,PG,116,FALSE,TRUE,FALSE,FALSE,FALSE,FALSE,FALSE,FALSE,TRUE,FALSE,TRUE,FALSE,FALSE,FALSE,FALSE,FALSE,FALSE,FALSE,FALSE,FALSE,English,TRUE,USA,TRUE,Won 1 Oscar. Another 19 wins & 25 nominations.,19,25,8.5,87,96,968454,tt0088763,490000000,4.90E+08,3.97E+08,8.87E+08,2.327149,2.327149,"Marty McFly, a 17-year-old high school student, is accidentally sent thirty years into the past in a time-traveling DeLorean invented by his close friend, the eccentric scientist Doc Brown.",Back to the Future Part II,1989,11/22/89,PG,108,FALSE,TRUE,FALSE,FALSE,FALSE,FALSE,FALSE,FALSE,TRUE,FALSE,TRUE,FALSE,FALSE,FALSE,FALSE,FALSE,FALSE,FALSE,FALSE,FALSE,English,TRUE,USA,TRUE,Nominated for 1 Oscar. Another 9 wins & 8 nominations.,9,8,7.8,57,65,441827,tt0096874,82266406,244000000,2.44E+08,4.39E+08,6.83E+08,2.05666,2.05666,"After visiting 2015, Marty McFly must repeat his visit to 1955 to prevent disastrous changes to 1985...without interfering with his first trip.",4,TRUE,TRUE,TRUE,TRUE,TRUE,TRUE,TRUE,TRUE,TRUE,TRUE,TRUE,TRUE,TRUE,TRUE,TRUE,TRUE,TRUE,TRUE,TRUE,TRUE,TRUE,TRUE,TRUE,TRUE,22,40,-30,-0.7,-526627,-44215668,-489999909,4.20E+07,-886999804,"(7.5,10]","(7.5,10]","(4e+08,1e+10]","(2e+08,3e+08]",1603,44215840,2
