The Godfather,The Godfather,1972,3/24/72,R,175,FALSE,FALSE,FALSE,FALSE,TRUE,TRUE,FALSE,FALSE,FALSE,FALSE,FALSE,FALSE,FALSE,FALSE,FALSE,FALSE,FALSE,FALSE,FALSE,FALSE,"English, Italian, Latin",TRUE,USA,TRUE,Won 3 Oscars. Another 24 wins & 28 nominations.,24,28,9.2,100,98,1479706,tt0068646,653000000,6.59E+08,5.38E+08,1.20E+09,4.882353,4.853484,The aging patriarch of an organized crime dynasty transfers control of his clandestine empire to his reluctant son.,The Godfather: Part II,1974,12/20/74,R,202,FALSE,FALSE,FALSE,FALSE,TRUE,TRUE,FALSE,FALSE,FALSE,FALSE,FALSE,FALSE,FALSE,FALSE,FALSE,FALSE,FALSE,FALSE,FALSE,FALSE,"English, Italian, Spanish, Latin, Sicilian",TRUE,USA,TRUE,Won 6 Oscars. Another 11 wins & 20 nominations.,11,20,9,90,97,1036316,tt0071562,57700527,211000000,2.11E+08,2.11E+08,2.11E+08,4.438502,4.438502,"The early life and career of Vito Corleone in 1920s New York City is portrayed, while his son, Michael, expands and tightens his grip on the family crime syndicate.",2,TRUE,TRUE,TRUE,TRUE,TRUE,TRUE,TRUE,TRUE,TRUE,TRUE,TRUE,TRUE,TRUE,TRUE,TRUE,TRUE,TRUE,TRUE,TRUE,TRUE,FALSE,TRUE,TRUE,TRUE,-17,-6,-10,-0.2,-443390,-29293967,-652999926,-3.27E+08,-1199999919,"(7.5,10]","(7.5,10]","(4e+08,1e+10]","(2e+08,3e+08]",1001,29294117,2
The Godfather,The Godfather: Part II,1974,12/20/74,R,202,FALSE,FALSE,FALSE,FALSE,TRUE,TRUE,FALSE,FALSE,FALSE,FALSE,FALSE,FALSE,FALSE,FALSE,FALSE,FALSE,FALSE,FALSE,FALSE,FALSE,"English, Italian, Spanish, Latin, Sicilian",TRUE,USA,TRUE,Won 6 Oscars. Another 11 wins & 20 nominations.,11,20,9,90,97,1036316,tt0071562,211000000,2.11E+08,2.11E+08,2.11E+08,4.438502,4.438502,"The early life and career of Vito Corleone in 1920s New York City is portrayed, while his son, Michael, expands and tightens his grip on the family crime syndicate.",The Godfather: Part III,1990,12/25/90,R,162,FALSE,FALSE,FALSE,FALSE,TRUE,TRUE,FALSE,FALSE,FALSE,FALSE,FALSE,FALSE,FALSE,FALSE,FALSE,FALSE,FALSE,FALSE,FALSE,FALSE,"English, Italian, German, Latin",TRUE,USA,TRUE,Nominated for 7 Oscars. Another 6 wins & 15 nominations.,6,15,7.6,60,68,332956,tt0099674,106000000,131000000,1.31E+08,1.38E+08,2.69E+08,1.969536,1.969536,"In the midst of trying to legitimize his business dealings in New York City and Italy in 1979, aging Mafia Don Michael Corleone seeks to avow for his sins, while taking his nephew Vincent Mancini under his wing.",16,TRUE,TRUE,TRUE,TRUE,TRUE,TRUE,TRUE,TRUE,TRUE,TRUE,TRUE,TRUE,TRUE,TRUE,TRUE,TRUE,TRUE,TRUE,TRUE,TRUE,FALSE,TRUE,TRUE,TRUE,29,-5,-30,-1.4,-703360,-57700518,-210999982,-7.30E+07,-210999905,"(7.5,10]","(7.5,10]","(2e+08,3e+08]","(1e+08,2e+08]",5849,57700527,3
The Grudge,The Grudge,2004,10/22/04,PG-13,91,FALSE,FALSE,TRUE,FALSE,FALSE,FALSE,FALSE,TRUE,FALSE,FALSE,FALSE,FALSE,TRUE,FALSE,FALSE,FALSE,FALSE,FALSE,FALSE,FALSE,"English, Japanese",TRUE,"USA, Japan",TRUE,2 wins & 10 nominations.,2,10,5.9,49,39,133786,tt0391198,148000000,1.48E+08,1.03E+08,2.50E+08,1.336554,1.336554,"An American nurse living and working in Tokyo is exposed to a mysterious supernatural curse, one that locks a person in a powerful rage before claiming their life and spreading to another victim.",The Grudge 2,2006,10/13/06,PG-13,102,FALSE,FALSE,TRUE,FALSE,FALSE,FALSE,FALSE,TRUE,FALSE,FALSE,FALSE,FALSE,FALSE,FALSE,FALSE,FALSE,FALSE,FALSE,FALSE,FALSE,"English, Japanese",TRUE,"USA, Japan",TRUE,3 nominations.,0,3,5,33,12,45002,tt0433386,25343503,49602100,49602100,40001344,89603444,1.267175,1.267175,Three interwoven stories about a terrible curse. A young woman encounters a malevolent supernatural force while searching for her missing sister in Tokyo; a mean high school prank goes horribly wrong; a woman with a deadly secret moves into a Chicago apartment building.,2,TRUE,TRUE,TRUE,TRUE,TRUE,TRUE,TRUE,TRUE,TRUE,TRUE,TRUE,TRUE,FALSE,TRUE,TRUE,TRUE,TRUE,TRUE,TRUE,TRUE,TRUE,TRUE,TRUE,TRUE,-15,25,-16,-0.9,-88784,-13365436,-147999819,-62998656,-249999760,"(5.1,5.9]","(0,5.1]","(1e+08,2e+08]","(0,1e+08]",721,13365536,2
The Grudge,The Grudge 2,2006,10/13/06,PG-13,102,FALSE,FALSE,TRUE,FALSE,FALSE,FALSE,FALSE,TRUE,FALSE,FALSE,FALSE,FALSE,FALSE,FALSE,FALSE,FALSE,FALSE,FALSE,FALSE,FALSE,"English, Japanese",TRUE,"USA, Japan",TRUE,3 nominations.,0,3,5,33,12,45002,tt0433386,49602100,49602100,40001344,89603444,1.267175,1.267175,Three interwoven stories about a terrible curse. A young woman encounters a malevolent supernatural force while searching for her missing sister in Tokyo; a mean high school prank goes horribly wrong; a woman with a deadly secret moves into a Chicago apartment building.,The Grudge 3,2009,6/2/09,R,90,FALSE,FALSE,TRUE,FALSE,FALSE,FALSE,FALSE,TRUE,FALSE,FALSE,FALSE,FALSE,TRUE,FALSE,FALSE,FALSE,FALSE,FALSE,FALSE,FALSE,"English, Japanese",TRUE,"USA, Japan",TRUE,N/A,N/A,N/A,4.7,,,15977,tt1053859,-999,0,,1809243,1809243,,,"A young Japanese woman who holds the key to stopping the evil spirit of Kayako, travels to the haunted Chicago apartment from the sequel, to stop the curse of Kayako once and for all.",3,FALSE,TRUE,TRUE,TRUE,TRUE,TRUE,TRUE,TRUE,TRUE,TRUE,TRUE,TRUE,FALSE,TRUE,TRUE,TRUE,TRUE,TRUE,TRUE,TRUE,TRUE,TRUE,TRUE,TRUE,37,41,,-0.3,-29025,-25343502,-49602099,,-89603443,"(0,5.1]","(0,5.1]","(0,1e+08]",,963,25343503,3
The Hangover,The Hangover,2009,6/5/09,R,100,FALSE,FALSE,FALSE,FALSE,FALSE,FALSE,FALSE,FALSE,FALSE,FALSE,TRUE,FALSE,FALSE,FALSE,FALSE,FALSE,FALSE,FALSE,FALSE,FALSE,English,TRUE,"USA, Germany",TRUE,Won 1 Golden Globe. Another 12 wins & 25 nominations.,12,25,7.7,73,78,682263,tt1119646,308000000,3.08E+08,2.12E+08,5.20E+08,1.11234,1.11234,"Three buddies wake up from a bachelor party in Las Vegas, with no memory of the previous night and the bachelor missing. They make their way around the city in order to find their friend before his wedding.",The Hangover Part II,2011,5/26/11,R,102,FALSE,FALSE,FALSE,FALSE,FALSE,FALSE,FALSE,FALSE,FALSE,FALSE,TRUE,FALSE,FALSE,FALSE,FALSE,FALSE,FALSE,FALSE,FALSE,FALSE,"English, Thai",TRUE,"USA, Thailand",TRUE,5 wins & 18 nominations.,5,18,6.4,44,33,439962,tt1411697,82424260,262000000,2.62E+08,3.42E+08,6.05E+08,1.030303,1.030303,"Two years after the bachelor party in Las Vegas, Phil, Stu, Alan, and Doug jet to Thailand for Stu's wedding. Stu's plan for a subdued pre-wedding brunch, however, goes seriously awry.",2,TRUE,TRUE,TRUE,TRUE,TRUE,TRUE,TRUE,TRUE,TRUE,TRUE,TRUE,TRUE,TRUE,TRUE,TRUE,TRUE,TRUE,TRUE,TRUE,TRUE,FALSE,TRUE,FALSE,TRUE,23,-6,-29,-1.3,-242301,-38931725,-307999901,1.30E+08,-519999816,"(7.5,10]","(5.9,6.7]","(3e+08,4e+08]","(2e+08,3e+08]",720,38931898,2
The Hangover,The Hangover Part II,2011,5/26/11,R,102,FALSE,FALSE,FALSE,FALSE,FALSE,FALSE,FALSE,FALSE,FALSE,FALSE,TRUE,FALSE,FALSE,FALSE,FALSE,FALSE,FALSE,FALSE,FALSE,FALSE,"English, Thai",TRUE,"USA, Thailand",TRUE,5 wins & 18 nominations.,5,18,6.4,44,33,439962,tt1411697,262000000,2.62E+08,3.42E+08,6.05E+08,1.030303,1.030303,"Two years after the bachelor party in Las Vegas, Phil, Stu, Alan, and Doug jet to Thailand for Stu's wedding. Stu's plan for a subdued pre-wedding brunch, however, goes seriously awry.",The Hangover Part III,2013,5/23/13,R,100,FALSE,FALSE,FALSE,FALSE,FALSE,FALSE,FALSE,FALSE,FALSE,FALSE,TRUE,FALSE,FALSE,FALSE,FALSE,FALSE,FALSE,FALSE,FALSE,FALSE,"English, Spanish",TRUE,USA,TRUE,2 wins & 7 nominations.,2,7,5.8,30,20,278165,tt1951261,102000000,111000000,1.11E+08,2.47E+08,3.59E+08,0.990453,0.990453,"When one of their own is kidnapped by an angry gangster, the Wolf Pack must track down Mr. Chow, who has escaped from prison and is on the run.",2,TRUE,TRUE,TRUE,TRUE,TRUE,TRUE,TRUE,TRUE,TRUE,TRUE,TRUE,TRUE,TRUE,TRUE,TRUE,TRUE,TRUE,TRUE,TRUE,TRUE,FALSE,TRUE,FALSE,TRUE,-22,45,-14,-0.6,-161797,-82424255,-261999992,-9.50E+07,-604999877,"(5.9,6.7]","(5.1,5.9]","(2e+08,3e+08]","(1e+08,2e+08]",728,82424260,3
The Hills Have Eyes,The Hills Have Eyes,2006,3/10/06,R,107,FALSE,FALSE,TRUE,FALSE,FALSE,FALSE,FALSE,TRUE,FALSE,FALSE,FALSE,FALSE,FALSE,FALSE,FALSE,FALSE,FALSE,FALSE,FALSE,FALSE,English,TRUE,"USA, France, Romania",TRUE,2 wins & 7 nominations.,2,7,6.4,52,52,151630,tt0454841,52941100,52941100,35284277,88225377,1.267174,1.267174,A family falls victim to a group of mutated cannibals in a desert far away from civilization.,The Hills Have Eyes 2: Mutant Attacks,2007,9/14/07,N/A,10,FALSE,FALSE,TRUE,FALSE,FALSE,FALSE,FALSE,FALSE,FALSE,FALSE,FALSE,FALSE,FALSE,FALSE,FALSE,FALSE,FALSE,FALSE,TRUE,FALSE,English,TRUE,USA,TRUE,N/A,N/A,N/A,7.2,,,18,tt1182281,18095967,25098100,25098100,20101449,45199549,1.206398,1.206398,Documentary about the mutants in The Hills Have Eyes II (2007).,1,FALSE,TRUE,TRUE,TRUE,TRUE,TRUE,TRUE,FALSE,TRUE,TRUE,TRUE,TRUE,TRUE,TRUE,TRUE,TRUE,TRUE,TRUE,FALSE,TRUE,TRUE,TRUE,FALSE,TRUE,22,9,,0.8,-151612,-19007546,-52940987,-15182828,-88225217,"(5.9,6.7]","(6.7,7.5]","(0,1e+08]","(0,1e+08]",553,19007614,2
The Hobbit,The Hobbit: An Unexpected Journey,2012,12/14/12,PG-13,169,FALSE,TRUE,FALSE,FALSE,FALSE,FALSE,FALSE,FALSE,FALSE,FALSE,FALSE,TRUE,FALSE,FALSE,FALSE,FALSE,FALSE,FALSE,FALSE,FALSE,English,TRUE,"USA, New Zealand",TRUE,Nominated for 3 Oscars. Another 10 wins & 72 nominations.,10,72,7.8,58,64,727602,tt0903624,314000000,3.14E+08,7.40E+08,1.05E+09,1.036397,1.036397,"A reluctant Hobbit, Bilbo Baggins, sets out to the Lonely Mountain with a spirited group of dwarves to reclaim their mountain home, and the gold within it from the dragon Smaug.",The Hobbit: The Desolation of Smaug,2013,12/13/13,PG-13,161,FALSE,TRUE,FALSE,FALSE,FALSE,FALSE,TRUE,FALSE,FALSE,FALSE,FALSE,FALSE,FALSE,FALSE,FALSE,FALSE,FALSE,FALSE,FALSE,FALSE,English,TRUE,"USA, New Zealand",TRUE,Nominated for 3 Oscars. Another 16 wins & 86 nominations.,16,86,7.8,66,74,575054,tt1170358,-999,262000000,2.62E+08,7.11E+08,9.72E+08,1.012418,1.012418,"The dwarves, along with Bilbo Baggins and Gandalf the Grey, continue their quest to reclaim Erebor, their homeland, from Smaug. Bilbo Baggins is in possession of a mysterious and magical ring.",1,TRUE,TRUE,TRUE,TRUE,TRUE,TRUE,FALSE,TRUE,TRUE,TRUE,TRUE,FALSE,TRUE,TRUE,TRUE,TRUE,TRUE,TRUE,TRUE,TRUE,TRUE,TRUE,TRUE,TRUE,8,4,8,0,-152548,1001,-313999901,-2.90E+07,-1049999753,"(7.5,10]","(7.5,10]","(3e+08,4e+08]","(2e+08,3e+08]",364,-999,2
The Hobbit,The Hobbit: The Desolation of Smaug,2013,12/13/13,PG-13,161,FALSE,TRUE,FALSE,FALSE,FALSE,FALSE,TRUE,FALSE,FALSE,FALSE,FALSE,FALSE,FALSE,FALSE,FALSE,FALSE,FALSE,FALSE,FALSE,FALSE,English,TRUE,"USA, New Zealand",TRUE,Nominated for 3 Oscars. Another 16 wins & 86 nominations.,16,86,7.8,66,74,575054,tt1170358,262000000,2.62E+08,7.11E+08,9.72E+08,1.012418,1.012418,"The dwarves, along with Bilbo Baggins and Gandalf the Grey, continue their quest to reclaim Erebor, their homeland, from Smaug. Bilbo Baggins is in possession of a mysterious and magical ring.",The Hobbit: The Battle of the Five Armies,2014,12/17/14,PG-13,144,FALSE,TRUE,FALSE,FALSE,FALSE,FALSE,TRUE,FALSE,FALSE,FALSE,FALSE,FALSE,FALSE,FALSE,FALSE,FALSE,FALSE,FALSE,FALSE,FALSE,English,TRUE,"New Zealand, USA",TRUE,Nominated for 1 Oscar. Another 7 wins & 51 nominations.,7,51,7.4,59,59,448272,tt2310332,-999,255000000,2.55E+08,7.00E+08,9.55E+08,1,1,Bilbo and company are forced to engage in a war against an array of combatants and keep the Lonely Mountain from falling into the hands of a rising darkness.,1,TRUE,TRUE,TRUE,TRUE,TRUE,TRUE,TRUE,TRUE,TRUE,TRUE,TRUE,TRUE,TRUE,TRUE,TRUE,TRUE,TRUE,TRUE,TRUE,TRUE,TRUE,TRUE,FALSE,TRUE,23,-15,-7,-0.4,-126782,1001,-261999904,-1.10E+07,-971999755,"(7.5,10]","(6.7,7.5]","(2e+08,3e+08]","(2e+08,3e+08]",369,-999,3
The Hunger Games,The Hunger Games,2012,3/23/12,PG-13,142,TRUE,TRUE,TRUE,FALSE,FALSE,FALSE,FALSE,FALSE,TRUE,FALSE,FALSE,FALSE,FALSE,FALSE,FALSE,FALSE,FALSE,FALSE,FALSE,FALSE,English,TRUE,USA,TRUE,Nominated for 1 Golden Globe. Another 33 wins & 47 nominations.,33,47,7.2,68,84,807384,tt1392170,422000000,4.22E+08,2.93E+08,7.15E+08,1.034183,1.034183,Katniss Everdeen voluntarily takes her younger sister's place in the Hunger Games: a televised competition in which two teenagers from each of the twelve Districts of Panem are chosen at random to fight to the death.,The Hunger Games: Catching Fire,2013,11/22/13,PG-13,146,TRUE,TRUE,TRUE,FALSE,FALSE,FALSE,FALSE,FALSE,TRUE,FALSE,FALSE,FALSE,FALSE,FALSE,FALSE,FALSE,FALSE,FALSE,FALSE,FALSE,English,TRUE,USA,TRUE,Nominated for 1 Golden Globe. Another 22 wins & 67 nominations.,22,67,7.5,76,89,585514,tt1951264,130000000,424000000,4.24E+08,4.40E+08,8.64E+08,0.999019,0.999019,Katniss Everdeen and Peeta Mellark become targets of the Capitol after their victory in the 74th Hunger Games sparks a rebellion in the Districts of Panem.,1,TRUE,TRUE,TRUE,TRUE,TRUE,TRUE,TRUE,TRUE,TRUE,TRUE,TRUE,TRUE,TRUE,TRUE,TRUE,TRUE,TRUE,TRUE,TRUE,TRUE,TRUE,TRUE,TRUE,TRUE,-12,14,8,0.3,-221870,-80666288,-421999843,1.47E+08,-714999767,"(6.7,7.5]","(6.7,7.5]","(4e+08,1e+10]","(4e+08,1e+10]",609,80666308,2
The Hunger Games,The Hunger Games: Catching Fire,2013,11/22/13,PG-13,146,TRUE,TRUE,TRUE,FALSE,FALSE,FALSE,FALSE,FALSE,TRUE,FALSE,FALSE,FALSE,FALSE,FALSE,FALSE,FALSE,FALSE,FALSE,FALSE,FALSE,English,TRUE,USA,TRUE,Nominated for 1 Golden Globe. Another 22 wins & 67 nominations.,22,67,7.5,76,89,585514,tt1951264,424000000,4.24E+08,4.40E+08,8.64E+08,0.999019,0.999019,Katniss Everdeen and Peeta Mellark become targets of the Capitol after their victory in the 74th Hunger Games sparks a rebellion in the Districts of Panem.,The Hunger Games: Mockingjay - Part 1,2014,11/21/14,PG-13,123,TRUE,TRUE,TRUE,FALSE,FALSE,FALSE,FALSE,FALSE,TRUE,FALSE,FALSE,FALSE,FALSE,FALSE,FALSE,FALSE,FALSE,FALSE,FALSE,FALSE,English,TRUE,USA,TRUE,Nominated for 1 Golden Globe. Another 21 wins & 31 nominations.,21,31,6.6,64,69,388371,tt1951265,125000000,337000000,3.37E+08,4.15E+08,7.52E+08,1,1,"Katniss Everdeen is in District 13 after she shatters the games forever. Under the leadership of President Coin and the advice of her trusted friends, Katniss spreads her wings as she fights to save Peeta and a nation moved by her courage.",1,TRUE,TRUE,TRUE,TRUE,TRUE,TRUE,TRUE,TRUE,TRUE,TRUE,TRUE,TRUE,TRUE,TRUE,TRUE,TRUE,TRUE,TRUE,TRUE,TRUE,TRUE,TRUE,TRUE,TRUE,-2,-29,-12,-0.9,-197143,-129999984,-423999874,-2.50E+07,-863999786,"(6.7,7.5]","(5.9,6.7]","(4e+08,1e+10]","(3e+08,4e+08]",364,1.30E+08,3
The Hunger Games,The Hunger Games: Mockingjay - Part 1,2014,11/21/14,PG-13,123,TRUE,TRUE,TRUE,FALSE,FALSE,FALSE,FALSE,FALSE,TRUE,FALSE,FALSE,FALSE,FALSE,FALSE,FALSE,FALSE,FALSE,FALSE,FALSE,FALSE,English,TRUE,USA,TRUE,Nominated for 1 Golden Globe. Another 21 wins & 31 nominations.,21,31,6.6,64,69,388371,tt1951265,337000000,3.37E+08,4.15E+08,7.52E+08,1,1,"Katniss Everdeen is in District 13 after she shatters the games forever. Under the leadership of President Coin and the advice of her trusted friends, Katniss spreads her wings as she fights to save Peeta and a nation moved by her courage.",The Hunger Games: Mockingjay - Part 2,2015,11/20/15,PG-13,137,TRUE,TRUE,TRUE,FALSE,FALSE,FALSE,FALSE,FALSE,TRUE,FALSE,FALSE,FALSE,FALSE,FALSE,FALSE,FALSE,FALSE,FALSE,FALSE,FALSE,English,TRUE,USA,TRUE,17 wins & 34 nominations.,17,34,6.5,65,70,260168,tt1951266,160000000,281723902,,371704359,653428261,,,Katniss and a team of rebels from District 13 prepare for the final battle that will decide the fate of Panem.,1,TRUE,TRUE,TRUE,TRUE,TRUE,TRUE,TRUE,TRUE,TRUE,TRUE,TRUE,TRUE,TRUE,TRUE,TRUE,TRUE,TRUE,TRUE,TRUE,TRUE,TRUE,TRUE,TRUE,TRUE,-6,2,1,-0.1,-128203,-124999999,-336999999,,-751999999,"(5.9,6.7]","(5.9,6.7]","(3e+08,4e+08]","(2e+08,3e+08]",364,1.25E+08,4
The Jungle Book,The Jungle Book 2,2003,2/14/03,G,72,FALSE,TRUE,FALSE,FALSE,FALSE,FALSE,FALSE,FALSE,FALSE,FALSE,FALSE,TRUE,FALSE,FALSE,TRUE,TRUE,FALSE,FALSE,FALSE,FALSE,English,TRUE,"USA, Australia",TRUE,1 win & 9 nominations.,1,9,5.4,38,19,14017,tt0283426,65934200,65934200,1.21E+08,1.87E+08,1.376451,1.376451,"Mowgli, missing the jungle and his old friends, runs away from the man village unaware of the danger he's in by going back to the wild.",The Jungle Book,2016,4/15/16,PG,106,FALSE,TRUE,FALSE,FALSE,FALSE,TRUE,TRUE,FALSE,FALSE,FALSE,FALSE,TRUE,FALSE,FALSE,FALSE,FALSE,FALSE,FALSE,FALSE,FALSE,English,TRUE,"UK, USA",TRUE,Won 1 Oscar. Another 31 wins & 54 nominations.,31,54,7.4,77,95,246564,tt3040964,175000000,364001123,,602549477,966550600,,,"After a threat from the tiger Shere Khan forces him to flee the jungle, a man-cub named Mowgli embarks on a journey of self discovery with the help of panther Bagheera and free-spirited bear Baloo.",13,FALSE,TRUE,TRUE,TRUE,FALSE,TRUE,FALSE,TRUE,TRUE,TRUE,TRUE,TRUE,TRUE,FALSE,FALSE,TRUE,TRUE,TRUE,TRUE,TRUE,TRUE,TRUE,FALSE,TRUE,23,-14,39,2,232547,-27529027,-65934199,,-186999999,"(5.1,5.9]","(6.7,7.5]","(0,1e+08]","(3e+08,4e+08]",4809,27529028,2
The Jungle Book,The Jungle Book,1967,10/18/67,G,78,FALSE,TRUE,FALSE,FALSE,FALSE,FALSE,FALSE,FALSE,FALSE,FALSE,FALSE,TRUE,FALSE,FALSE,TRUE,TRUE,FALSE,FALSE,FALSE,FALSE,English,TRUE,USA,TRUE,Nominated for 1 Oscar. Another 4 wins & 3 nominations.,4,3,7.6,65,87,155312,tt0061852,466000000,8.96E+08,4.04E+08,1.30E+09,6.319364,4.311391,Bagheera the Panther and Baloo the Bear have a difficult time trying to convince a boy to leave the jungle for human civilization.,The Jungle Book 2,2003,2/14/03,G,72,FALSE,TRUE,FALSE,FALSE,FALSE,FALSE,FALSE,FALSE,FALSE,FALSE,FALSE,TRUE,FALSE,FALSE,TRUE,TRUE,FALSE,FALSE,FALSE,FALSE,English,TRUE,"USA, Australia",TRUE,1 win & 9 nominations.,1,9,5.4,38,19,14017,tt0283426,27529028,65934200,65934200,1.21E+08,1.87E+08,1.376451,1.376451,"Mowgli, missing the jungle and his old friends, runs away from the man village unaware of the danger he's in by going back to the wild.",36,TRUE,TRUE,TRUE,TRUE,TRUE,TRUE,TRUE,TRUE,TRUE,TRUE,TRUE,TRUE,TRUE,TRUE,TRUE,TRUE,TRUE,TRUE,TRUE,TRUE,TRUE,TRUE,FALSE,TRUE,-33,38,-27,-2.2,-141295,1103,-465999781,-2.83E+08,-1299999933,"(7.5,10]","(5.1,5.9]","(4e+08,1e+10]","(0,1e+08]",12903,-999,3
The Karate Kid,The Karate Kid,1984,6/22/84,PG,126,TRUE,FALSE,FALSE,FALSE,FALSE,TRUE,FALSE,FALSE,FALSE,FALSE,FALSE,TRUE,FALSE,FALSE,FALSE,FALSE,FALSE,FALSE,FALSE,FALSE,"English, Japanese",TRUE,USA,TRUE,Nominated for 1 Oscar. Another 2 wins & 2 nominations.,2,2,7.2,60,88,162483,tt0087538,224000000,2.24E+08,2.24E+08,2.24E+08,2.470238,2.470238,"A boy and his mother move to California for a new job. He struggles to fit in, as a group of karate students starts to bully him for dating a rich girl from their clique. It's up to the Japanese landlord, Miyagi, to teach him karate.",The Karate Kid Part II,1986,6/20/86,PG,113,TRUE,FALSE,FALSE,FALSE,FALSE,FALSE,FALSE,FALSE,FALSE,FALSE,FALSE,TRUE,FALSE,TRUE,FALSE,FALSE,FALSE,FALSE,FALSE,FALSE,English,TRUE,USA,TRUE,Nominated for 1 Oscar. Another 4 wins & 2 nominations.,4,2,6,55,42,66840,tt0091326,-999,258000000,2.58E+08,2.58E+08,2.58E+08,2.237196,2.237196,"Daniel accompanies his mentor, Mr. Miyagi, to Miyagi's childhood home in Okinawa. Miyagi visits his dying father and confronts his old rival, while Daniel falls in love and inadvertently makes a new rival of his own.",2,TRUE,TRUE,TRUE,TRUE,FALSE,TRUE,TRUE,TRUE,TRUE,TRUE,TRUE,TRUE,TRUE,TRUE,TRUE,TRUE,TRUE,TRUE,TRUE,TRUE,FALSE,TRUE,TRUE,TRUE,11,2,-5,-1.2,-95643,1001,-223999903,3.40E+07,-223999906,"(6.7,7.5]","(5.9,6.7]","(2e+08,3e+08]","(2e+08,3e+08]",728,-999,2
The Karate Kid,The Karate Kid Part II,1986,6/20/86,PG,113,TRUE,FALSE,FALSE,FALSE,FALSE,FALSE,FALSE,FALSE,FALSE,FALSE,FALSE,TRUE,FALSE,TRUE,FALSE,FALSE,FALSE,FALSE,FALSE,FALSE,English,TRUE,USA,TRUE,Nominated for 1 Oscar. Another 4 wins & 2 nominations.,4,2,6,55,42,66840,tt0091326,258000000,2.58E+08,2.58E+08,2.58E+08,2.237196,2.237196,"Daniel accompanies his mentor, Mr. Miyagi, to Miyagi's childhood home in Okinawa. Miyagi visits his dying father and confronts his old rival, while Daniel falls in love and inadvertently makes a new rival of his own.",The Karate Kid Part III,1989,6/30/89,PG,112,TRUE,FALSE,FALSE,FALSE,FALSE,TRUE,FALSE,FALSE,FALSE,FALSE,FALSE,TRUE,FALSE,FALSE,FALSE,FALSE,FALSE,FALSE,FALSE,FALSE,English,TRUE,USA,TRUE,5 nominations.,0,5,5.2,36,15,45175,tt0097647,-999,81445100,81445100,81445100,81445100,2.090679,2.090679,"Ostracised villain John Kreese attempts to gain revenge on Daniel and Miyagi, with the help of a Vietnam War comrade, the wealthy owner of a toxic waste disposal business.",3,TRUE,TRUE,TRUE,TRUE,FALSE,TRUE,TRUE,TRUE,TRUE,TRUE,TRUE,TRUE,TRUE,TRUE,TRUE,TRUE,TRUE,TRUE,TRUE,TRUE,TRUE,TRUE,TRUE,TRUE,-34,30,-19,-0.8,-21665,1001,-257999762,-176554900,-257999766,"(5.9,6.7]","(5.1,5.9]","(2e+08,3e+08]","(0,1e+08]",1106,-999,3
The Karate Kid,The Karate Kid Part III,1989,6/30/89,PG,112,TRUE,FALSE,FALSE,FALSE,FALSE,TRUE,FALSE,FALSE,FALSE,FALSE,FALSE,TRUE,FALSE,FALSE,FALSE,FALSE,FALSE,FALSE,FALSE,FALSE,English,TRUE,USA,TRUE,5 nominations.,0,5,5.2,36,15,45175,tt0097647,81445100,81445100,81445100,81445100,2.090679,2.090679,"Ostracised villain John Kreese attempts to gain revenge on Daniel and Miyagi, with the help of a Vietnam War comrade, the wealthy owner of a toxic waste disposal business.",The Next Karate Kid,1994,9/9/94,PG,107,TRUE,FALSE,FALSE,FALSE,FALSE,TRUE,FALSE,FALSE,FALSE,FALSE,FALSE,TRUE,FALSE,TRUE,FALSE,FALSE,FALSE,FALSE,FALSE,FALSE,English,TRUE,USA,TRUE,1 win.,1,0,4.4,36,7,23554,tt0110657,-999,17701600,17701600,13725203,31426803,1.985647,1.985647,Mr. Miyagi is back and he takes a new pupil under his wing; a troubled adolescent girl.,5,TRUE,TRUE,TRUE,TRUE,TRUE,TRUE,TRUE,TRUE,TRUE,TRUE,TRUE,TRUE,TRUE,TRUE,TRUE,TRUE,TRUE,TRUE,TRUE,TRUE,TRUE,TRUE,TRUE,TRUE,1,-45,0,-0.8,-21621,1001,-81445037,-67719897,-81444969,"(5.1,5.9]","(0,5.1]","(0,1e+08]","(0,1e+08]",1897,-999,4
The Karate Kid,The Next Karate Kid,1994,9/9/94,PG,107,TRUE,FALSE,FALSE,FALSE,FALSE,TRUE,FALSE,FALSE,FALSE,FALSE,FALSE,TRUE,FALSE,TRUE,FALSE,FALSE,FALSE,FALSE,FALSE,FALSE,English,TRUE,USA,TRUE,1 win.,1,0,4.4,36,7,23554,tt0110657,17701600,17701600,13725203,31426803,1.985647,1.985647,Mr. Miyagi is back and he takes a new pupil under his wing; a troubled adolescent girl.,The Karate Kid,2010,6/11/10,PG,140,TRUE,FALSE,FALSE,FALSE,FALSE,TRUE,FALSE,FALSE,FALSE,FALSE,FALSE,TRUE,FALSE,FALSE,FALSE,FALSE,FALSE,FALSE,FALSE,FALSE,"English, Mandarin",TRUE,"USA, China",TRUE,5 wins & 12 nominations.,5,12,6.2,61,66,149458,tt1155076,41761008,184000000,1.84E+08,1.91E+08,3.75E+08,1.044025,1.044025,"Work causes a single mother to move to China with her young son; in his new home, the boy embraces kung fu, taught to him by a master.",16,TRUE,TRUE,TRUE,TRUE,TRUE,TRUE,TRUE,TRUE,TRUE,TRUE,TRUE,TRUE,TRUE,TRUE,TRUE,TRUE,TRUE,TRUE,TRUE,TRUE,FALSE,TRUE,FALSE,TRUE,28,6,25,1.8,125904,1126,-17701554,177274797,-31426675,"(0,5.1]","(5.9,6.7]","(0,1e+08]","(1e+08,2e+08]",5754,-999,5
The Lord of the Rings,The Lord of the Rings: The Fellowship of the Ring,2001,12/19/01,PG-13,178,FALSE,TRUE,FALSE,FALSE,FALSE,TRUE,TRUE,FALSE,FALSE,FALSE,FALSE,FALSE,FALSE,FALSE,FALSE,FALSE,FALSE,FALSE,FALSE,FALSE,"English, Sindarin",TRUE,"New Zealand, USA",TRUE,Won 4 Oscars. Another 113 wins & 123 nominations.,113,123,8.8,92,91,1553588,tt0120737,452000000,4.55E+08,8.02E+08,1.26E+09,1.442727,1.441425,A meek Hobbit from the Shire and eight companions set out on a journey to destroy the powerful One Ring and save Middle-earth from the Dark Lord Sauron.,The Lord of the Rings: The Two Towers,2002,12/18/02,PG,179,FALSE,TRUE,FALSE,FALSE,FALSE,TRUE,TRUE,FALSE,FALSE,FALSE,FALSE,FALSE,FALSE,FALSE,FALSE,FALSE,FALSE,FALSE,FALSE,FALSE,"English, Sindarin, Old English",TRUE,"New Zealand, USA",TRUE,Won 2 Oscars. Another 118 wins & 137 nominations.,118,137,8.7,87,95,1383659,tt0167261,132000000,476000000,4.79E+08,8.17E+08,1.30E+09,1.399641,1.39868,"While Frodo and Sam edge closer to Mordor with the help of the shifty Gollum, the divided fellowship makes a stand against Sauron's new ally, Saruman, and his hordes of Isengard.",1,FALSE,TRUE,TRUE,TRUE,TRUE,TRUE,TRUE,TRUE,TRUE,TRUE,TRUE,TRUE,TRUE,TRUE,TRUE,TRUE,TRUE,TRUE,TRUE,TRUE,FALSE,TRUE,TRUE,TRUE,0,4,-5,-0.1,-169929,-133999978,-451999838,1.50E+07,-1259999967,"(7.5,10]","(7.5,10]","(4e+08,1e+10]","(4e+08,1e+10]",364,1.34E+08,2
The Lord of the Rings,The Lord of the Rings: The Two Towers,2002,12/18/02,PG,179,FALSE,TRUE,FALSE,FALSE,FALSE,TRUE,TRUE,FALSE,FALSE,FALSE,FALSE,FALSE,FALSE,FALSE,FALSE,FALSE,FALSE,FALSE,FALSE,FALSE,"English, Sindarin, Old English",TRUE,"New Zealand, USA",TRUE,Won 2 Oscars. Another 118 wins & 137 nominations.,118,137,8.7,87,95,1383659,tt0167261,476000000,4.79E+08,8.17E+08,1.30E+09,1.399641,1.39868,"While Frodo and Sam edge closer to Mordor with the help of the shifty Gollum, the divided fellowship makes a stand against Sauron's new ally, Saruman, and his hordes of Isengard.",The Lord of the Rings: The Return of the King,2003,12/17/03,PG-13,201,FALSE,TRUE,FALSE,FALSE,FALSE,TRUE,TRUE,FALSE,FALSE,FALSE,FALSE,FALSE,FALSE,FALSE,FALSE,FALSE,FALSE,FALSE,FALSE,FALSE,"English, Quenya, Old English, Sindarin",TRUE,"New Zealand, USA",TRUE,Won 11 Oscars. Another 197 wins & 122 nominations.,197,122,8.9,94,93,1533400,tt0167260,127000000,511000000,5.12E+08,1.01E+09,1.52E+09,1.35472,1.354016,Gandalf and Aragorn lead the World of Men against Sauron's army to draw his gaze from Frodo and Sam as they approach Mount Doom with the One Ring.,1,FALSE,TRUE,TRUE,TRUE,TRUE,TRUE,TRUE,TRUE,TRUE,TRUE,TRUE,TRUE,TRUE,TRUE,TRUE,TRUE,TRUE,TRUE,TRUE,TRUE,FALSE,TRUE,TRUE,TRUE,8,-1,7,0.2,149741,-131999983,-475999818,1.93E+08,-1299999954,"(7.5,10]","(7.5,10]","(4e+08,1e+10]","(4e+08,1e+10]",364,1.32E+08,3
