Hellboy,Hellboy II: The Golden Army,2008,7/11/08,PG-13,120,TRUE,TRUE,FALSE,FALSE,FALSE,FALSE,TRUE,TRUE,TRUE,TRUE,FALSE,FALSE,FALSE,FALSE,FALSE,FALSE,FALSE,FALSE,FALSE,FALSE,"English, Scottish Gaelic",TRUE,"USA, Germany, Hungary",TRUE,Nominated for 1 Oscar. Another 5 wins & 29 nominations.,5,29,7,78,86,246975,tt0411477,87839600,87839600,97567318,1.85E+08,1.15599,1.15599,"The mythical world starts a rebellion against humanity in order to rule the Earth, so Hellboy (Ron Perlman) and his team must save the world from the rebellious creatures.",Hellboy,2019,4/12/19,R,120,TRUE,TRUE,FALSE,FALSE,FALSE,FALSE,TRUE,TRUE,TRUE,FALSE,FALSE,FALSE,FALSE,FALSE,FALSE,FALSE,FALSE,FALSE,FALSE,FALSE,"English, Spanish, German, Russian",TRUE,"USA, UK, Bulgaria, Canada",TRUE,N/A,N/A,N/A,5.2,31,17,58883,tt2274648,50000000,21903748,,22760942,44664690,,,"Based on the graphic novels by Mike Mignola, Hellboy, caught between the worlds of the supernatural and human, battles an ancient sorceress bent on revenge.",11,FALSE,TRUE,TRUE,TRUE,TRUE,TRUE,TRUE,TRUE,TRUE,FALSE,TRUE,TRUE,TRUE,TRUE,TRUE,TRUE,TRUE,TRUE,TRUE,TRUE,FALSE,TRUE,FALSE,TRUE,1,42,-47,-1.8,-188092,-98259107,-87839599,,-184999999,"(6.7,7.5]","(5.1,5.9]","(0,1e+08]","(0,1e+08]",3927,98259108,3
Home Alone,Home Alone,1990,11/16/90,PG,103,FALSE,FALSE,FALSE,FALSE,FALSE,FALSE,FALSE,FALSE,FALSE,FALSE,TRUE,TRUE,FALSE,FALSE,FALSE,FALSE,FALSE,FALSE,FALSE,FALSE,English,TRUE,USA,TRUE,Nominated for 2 Oscars. Another 10 wins & 4 nominations.,10,4,7.6,63,65,419591,tt0099785,562000000,5.62E+08,3.76E+08,9.38E+08,1.967355,1.967355,An eight-year-old troublemaker must protect his house from a pair of burglars when he is accidentally left home alone by his family during Christmas vacation.,Home Alone 2: Lost in New York,1992,11/20/92,PG,120,FALSE,TRUE,FALSE,FALSE,TRUE,FALSE,FALSE,FALSE,FALSE,FALSE,TRUE,TRUE,FALSE,FALSE,FALSE,FALSE,FALSE,FALSE,FALSE,FALSE,"English, French",TRUE,USA,TRUE,3 wins & 3 nominations.,3,3,6.7,,33,271294,tt0104431,-999,347000000,3.47E+08,3.71E+08,7.18E+08,2.00104,2.00104,"One year after Kevin McCallister was left home alone and had to defeat a pair of bumbling burglars, he accidentally finds himself stranded in New York City - and the same criminals are not far behind.",2,TRUE,TRUE,FALSE,FALSE,TRUE,TRUE,TRUE,TRUE,TRUE,TRUE,TRUE,TRUE,TRUE,TRUE,TRUE,TRUE,TRUE,TRUE,TRUE,TRUE,FALSE,TRUE,TRUE,TRUE,21,-9,,-0.9,-148297,-35412387,-561999873,-5.00E+06,-937999791,"(7.5,10]","(5.9,6.7]","(4e+08,1e+10]","(3e+08,4e+08]",735,35412389,2
Home Alone,Home Alone 2: Lost in New York,1992,11/20/92,PG,120,FALSE,TRUE,FALSE,FALSE,TRUE,FALSE,FALSE,FALSE,FALSE,FALSE,TRUE,TRUE,FALSE,FALSE,FALSE,FALSE,FALSE,FALSE,FALSE,FALSE,"English, French",TRUE,USA,TRUE,3 wins & 3 nominations.,3,3,6.7,,33,271294,tt0104431,347000000,3.47E+08,3.71E+08,7.18E+08,2.00104,2.00104,"One year after Kevin McCallister was left home alone and had to defeat a pair of bumbling burglars, he accidentally finds himself stranded in New York City - and the same criminals are not far behind.",Home Alone 3,1997,12/12/97,PG,102,FALSE,FALSE,FALSE,FALSE,TRUE,FALSE,FALSE,FALSE,FALSE,FALSE,TRUE,TRUE,FALSE,FALSE,FALSE,FALSE,FALSE,FALSE,FALSE,FALSE,"English, Polish",TRUE,USA,TRUE,3 nominations.,0,3,4.4,,29,97555,tt0119303,57115348,55120800,55120800,86029993,1.41E+08,1.784855,1.784855,"Alex Pruitt, a young boy of nine living in Chicago, fends off thieves who seek a top-secret chip in his toy car to support a North Korean terrorist organization's next deed.",5,TRUE,TRUE,FALSE,TRUE,TRUE,TRUE,TRUE,TRUE,TRUE,TRUE,TRUE,TRUE,TRUE,TRUE,TRUE,TRUE,TRUE,TRUE,TRUE,TRUE,FALSE,TRUE,TRUE,TRUE,-26,0,,-2.3,-173739,1148,-346999804,-284970007,-717999960,"(5.9,6.7]","(0,5.1]","(3e+08,4e+08]","(0,1e+08]",1848,-999,3
Hostel,Hostel,2005,1/6/06,R,94,FALSE,FALSE,FALSE,FALSE,FALSE,FALSE,FALSE,TRUE,FALSE,FALSE,FALSE,FALSE,FALSE,FALSE,FALSE,FALSE,FALSE,FALSE,FALSE,FALSE,"English, Czech, German, Dutch, Slovak, Japanese, Icelandic, Russian, Spanish",TRUE,"USA, Germany, Czech Republic, Slovakia, Iceland",TRUE,4 wins & 12 nominations.,4,12,5.9,55,61,161452,tt0450278,59971000,59971000,42136741,1.02E+08,1.267177,1.267177,"Three backpackers head to a Slovak city that promises to meet their hedonistic expectations, with no idea of the hell that awaits them.",Hostel: Part II,2007,6/8/07,R,94,FALSE,FALSE,FALSE,FALSE,FALSE,FALSE,FALSE,TRUE,FALSE,FALSE,FALSE,FALSE,FALSE,FALSE,FALSE,FALSE,FALSE,FALSE,FALSE,FALSE,"English, Slovak, Italian, Czech",TRUE,"USA, Czech Republic, Italy, Iceland, Slovakia",TRUE,5 nominations.,0,5,5.5,46,44,81451,tt0498353,12305255,21244000,21244000,21727303,42971303,1.206398,1.206398,"Three American college students studying abroad are lured to a Slovakian hostel, and discover the grim reality behind it.",2,TRUE,TRUE,TRUE,TRUE,TRUE,TRUE,TRUE,TRUE,TRUE,TRUE,TRUE,TRUE,TRUE,TRUE,TRUE,TRUE,TRUE,TRUE,TRUE,TRUE,FALSE,TRUE,FALSE,TRUE,-34,41,-9,-0.4,-80001,-6082386,-59970890,-20409438,-101999842,"(5.1,5.9]","(5.1,5.9]","(0,1e+08]","(0,1e+08]",518,6082448,2
How to Train Your Dragon,How to Train Your Dragon,2010,3/26/10,PG,98,TRUE,TRUE,FALSE,FALSE,FALSE,FALSE,TRUE,FALSE,FALSE,FALSE,FALSE,TRUE,FALSE,FALSE,TRUE,FALSE,FALSE,FALSE,FALSE,FALSE,English,TRUE,USA,TRUE,Nominated for 2 Oscars. Another 25 wins & 60 nominations.,25,60,8.1,74,99,623056,tt0892769,227000000,2.27E+08,2.90E+08,5.17E+08,1.044025,1.044025,"A hapless young Viking who aspires to hunt dragons becomes the unlikely friend of a young dragon himself, and learns there may be more to the creatures than he assumed.",How to Train Your Dragon 2,2014,6/13/14,PG,102,TRUE,TRUE,FALSE,FALSE,FALSE,FALSE,TRUE,FALSE,FALSE,FALSE,FALSE,TRUE,FALSE,FALSE,TRUE,FALSE,FALSE,FALSE,FALSE,FALSE,English,TRUE,USA,TRUE,Nominated for 1 Oscar. Another 14 wins & 60 nominations.,14,60,7.8,76,92,286877,tt1646971,146000000,178000000,1.78E+08,4.46E+08,6.24E+08,1.008292,1.008292,"When Hiccup and Toothless discover an ice cave that is home to hundreds of new wild dragons and the mysterious Dragon Rider, the two friends find themselves at the center of a battle to protect the peace.",4,TRUE,TRUE,TRUE,TRUE,TRUE,TRUE,TRUE,TRUE,TRUE,TRUE,TRUE,TRUE,TRUE,TRUE,TRUE,TRUE,TRUE,TRUE,TRUE,TRUE,TRUE,TRUE,TRUE,TRUE,-14,1,2,-0.3,-336179,-171999970,-226999957,1.56E+08,-516999813,"(7.5,10]","(7.5,10]","(2e+08,3e+08]","(1e+08,2e+08]",1540,1.72E+08,2
How to Train Your Dragon,How to Train Your Dragon 2,2014,6/13/14,PG,102,TRUE,TRUE,FALSE,FALSE,FALSE,FALSE,TRUE,FALSE,FALSE,FALSE,FALSE,TRUE,FALSE,FALSE,TRUE,FALSE,FALSE,FALSE,FALSE,FALSE,English,TRUE,USA,TRUE,Nominated for 1 Oscar. Another 14 wins & 60 nominations.,14,60,7.8,76,92,286877,tt1646971,178000000,1.78E+08,4.46E+08,6.24E+08,1.008292,1.008292,"When Hiccup and Toothless discover an ice cave that is home to hundreds of new wild dragons and the mysterious Dragon Rider, the two friends find themselves at the center of a battle to protect the peace.",How to Train Your Dragon: The Hidden World,2019,2/22/19,PG,104,TRUE,TRUE,FALSE,FALSE,FALSE,FALSE,TRUE,FALSE,FALSE,FALSE,FALSE,TRUE,FALSE,FALSE,TRUE,FALSE,FALSE,FALSE,FALSE,FALSE,English,TRUE,"USA, Japan",TRUE,N/A,N/A,N/A,7.5,71,90,80386,tt2386490,129000000,160799505,,359097143,519896648,,,"When Hiccup discovers Toothless isn't the only Night Fury, he must seek """"""""The Hidden World"""""""", a secret Dragon Utopia before a hired tyrant named Grimmel finds it first.",5,TRUE,TRUE,TRUE,TRUE,TRUE,TRUE,TRUE,TRUE,TRUE,TRUE,TRUE,TRUE,TRUE,TRUE,TRUE,TRUE,TRUE,TRUE,TRUE,TRUE,TRUE,TRUE,FALSE,TRUE,29,14,-5,-0.3,-206491,-145999999,-177999999,,-623999999,"(7.5,10]","(6.7,7.5]","(1e+08,2e+08]","(1e+08,2e+08]",1715,1.46E+08,3
Hulk,Hulk,2003,6/20/03,PG-13,138,TRUE,FALSE,FALSE,FALSE,FALSE,FALSE,FALSE,FALSE,TRUE,FALSE,FALSE,FALSE,FALSE,FALSE,FALSE,FALSE,FALSE,FALSE,FALSE,FALSE,"English, Spanish",TRUE,USA,TRUE,3 wins & 14 nominations.,3,14,5.6,54,62,242957,tt0286716,182000000,1.82E+08,1.56E+08,3.38E+08,1.376451,1.376451,"Bruce Banner, a genetics researcher with a tragic past, suffers an accident that causes him to transform into a raging green monster when he gets angry.",The Incredible Hulk,2008,6/13/08,PG-13,112,TRUE,TRUE,FALSE,FALSE,FALSE,FALSE,FALSE,FALSE,TRUE,FALSE,FALSE,FALSE,FALSE,FALSE,FALSE,FALSE,FALSE,FALSE,FALSE,FALSE,"English, Portuguese, Spanish",TRUE,USA,TRUE,1 win & 8 nominations.,1,8,6.7,61,67,412381,tt0800080,173000000,156000000,1.56E+08,1.49E+08,3.05E+08,1.155989,1.155989,"Bruce Banner, a scientist on the run from the U.S. Government, must find a cure for the monster he turns into, whenever he loses his temper.",5,TRUE,TRUE,FALSE,TRUE,TRUE,TRUE,TRUE,TRUE,TRUE,TRUE,TRUE,TRUE,TRUE,TRUE,TRUE,TRUE,TRUE,TRUE,TRUE,TRUE,FALSE,TRUE,TRUE,TRUE,-25,53,7,1.1,169424,-188999954,-181999970,-7.00E+06,-337999891,"(5.1,5.9]","(5.9,6.7]","(1e+08,2e+08]","(1e+08,2e+08]",1820,1.89E+08,2
I Know What You Did Last Summer,I Know What You Did Last Summer,1997,10/17/97,R,101,FALSE,FALSE,FALSE,FALSE,FALSE,FALSE,FALSE,TRUE,FALSE,FALSE,FALSE,FALSE,TRUE,FALSE,FALSE,FALSE,FALSE,FALSE,FALSE,FALSE,English,TRUE,USA,TRUE,3 wins & 7 nominations.,3,7,5.7,52,42,125396,tt0119345,131000000,1.31E+08,95838800,2.27E+08,1.808279,1.808279,Four young friends bound by a tragic accident are reunited when they find themselves being stalked by a hook-wielding maniac in their small seaside town.,I Still Know What You Did Last Summer,1998,11/13/98,R,100,FALSE,FALSE,FALSE,FALSE,FALSE,FALSE,FALSE,TRUE,FALSE,FALSE,FALSE,FALSE,TRUE,FALSE,FALSE,FALSE,FALSE,FALSE,FALSE,FALSE,English,TRUE,"USA, Mexico",TRUE,4 wins & 7 nominations.,4,7,4.7,21,7,65037,tt0130018,114000000,70296700,70296700,70296700,70296700,1.757325,1.757325,"The murderous fisherman with a hook is back to once again stalk the two surviving teens, Julie and Ray, who had left him for dead, as well as cause even more murder and mayhem, this time at a posh island resort.",1,TRUE,TRUE,TRUE,TRUE,TRUE,TRUE,TRUE,TRUE,TRUE,TRUE,TRUE,TRUE,TRUE,TRUE,TRUE,TRUE,TRUE,TRUE,TRUE,TRUE,TRUE,TRUE,FALSE,TRUE,0,0,-31,-1,-60359,1012,-130999772,-25542100,-226999779,"(5.1,5.9]","(0,5.1]","(1e+08,2e+08]","(0,1e+08]",392,-999,2
Ice Age,Ice Age,2002,3/15/02,PG,81,FALSE,TRUE,FALSE,FALSE,FALSE,FALSE,TRUE,FALSE,FALSE,FALSE,TRUE,TRUE,FALSE,FALSE,TRUE,FALSE,FALSE,FALSE,FALSE,FALSE,English,TRUE,USA,TRUE,Nominated for 1 Oscar. Another 5 wins & 29 nominations.,5,29,7.5,60,77,414313,tt0268380,252000000,2.52E+08,2.96E+08,5.48E+08,1.428571,1.428571,"Set during the Ice Age, a sabertooth tiger, a sloth, and a wooly mammoth find a lost human infant, and they try to return him to his tribe.",Ice Age: The Meltdown,2006,3/31/06,PG,91,FALSE,TRUE,FALSE,FALSE,FALSE,FALSE,FALSE,FALSE,FALSE,FALSE,TRUE,TRUE,FALSE,FALSE,TRUE,FALSE,FALSE,FALSE,FALSE,FALSE,English,TRUE,USA,TRUE,8 wins & 16 nominations.,8,16,6.8,58,57,241427,tt0438097,101000000,248000000,2.48E+08,5.90E+08,8.38E+08,1.267176,1.267176,"Manny, Sid, and Diego discover that the ice age is coming to an end, and join everybody for a journey to higher ground. On the trip, they discover that Manny, in fact, is not the last of the woolly mammoths.",4,TRUE,TRUE,TRUE,TRUE,TRUE,TRUE,FALSE,TRUE,TRUE,TRUE,TRUE,TRUE,TRUE,TRUE,TRUE,TRUE,TRUE,TRUE,TRUE,TRUE,TRUE,TRUE,TRUE,TRUE,-1,-12,-2,-0.7,-172886,-84285708,-251999908,2.94E+08,-547999770,"(6.7,7.5]","(6.7,7.5]","(2e+08,3e+08]","(2e+08,3e+08]",1477,84285712,2
Ice Age,Ice Age: The Meltdown,2006,3/31/06,PG,91,FALSE,TRUE,FALSE,FALSE,FALSE,FALSE,FALSE,FALSE,FALSE,FALSE,TRUE,TRUE,FALSE,FALSE,TRUE,FALSE,FALSE,FALSE,FALSE,FALSE,English,TRUE,USA,TRUE,8 wins & 16 nominations.,8,16,6.8,58,57,241427,tt0438097,248000000,2.48E+08,5.90E+08,8.38E+08,1.267176,1.267176,"Manny, Sid, and Diego discover that the ice age is coming to an end, and join everybody for a journey to higher ground. On the trip, they discover that Manny, in fact, is not the last of the woolly mammoths.",Ice Age: Dawn of the Dinosaurs,2009,7/1/09,PG,94,FALSE,TRUE,FALSE,FALSE,FALSE,FALSE,FALSE,FALSE,FALSE,FALSE,TRUE,TRUE,FALSE,FALSE,TRUE,FALSE,FALSE,FALSE,FALSE,FALSE,English,TRUE,USA,TRUE,3 wins & 13 nominations.,3,13,6.9,50,46,210032,tt1080016,100000000,219000000,2.19E+08,7.68E+08,9.86E+08,1.112437,1.112437,"When Sid's attempt to adopt three dinosaur eggs gets him abducted by their real mother to an underground lost world, his friends attempt to rescue him.",3,TRUE,TRUE,TRUE,TRUE,TRUE,TRUE,TRUE,TRUE,TRUE,TRUE,TRUE,TRUE,TRUE,TRUE,TRUE,TRUE,TRUE,TRUE,TRUE,TRUE,TRUE,TRUE,TRUE,TRUE,-21,-3,-8,0.1,-31395,-100999997,-247999922,1.78E+08,-837999752,"(6.7,7.5]","(6.7,7.5]","(2e+08,3e+08]","(2e+08,3e+08]",1188,1.01E+08,3
Ice Age,Ice Age: Dawn of the Dinosaurs,2009,7/1/09,PG,94,FALSE,TRUE,FALSE,FALSE,FALSE,FALSE,FALSE,FALSE,FALSE,FALSE,TRUE,TRUE,FALSE,FALSE,TRUE,FALSE,FALSE,FALSE,FALSE,FALSE,English,TRUE,USA,TRUE,3 wins & 13 nominations.,3,13,6.9,50,46,210032,tt1080016,219000000,2.19E+08,7.68E+08,9.86E+08,1.112437,1.112437,"When Sid's attempt to adopt three dinosaur eggs gets him abducted by their real mother to an underground lost world, his friends attempt to rescue him.",Ice Age: Continental Drift,2012,7/13/12,PG,88,FALSE,TRUE,FALSE,FALSE,FALSE,TRUE,TRUE,FALSE,FALSE,FALSE,TRUE,TRUE,FALSE,FALSE,TRUE,FALSE,FALSE,FALSE,FALSE,FALSE,English,TRUE,USA,TRUE,2 wins & 11 nominations.,2,11,6.6,49,37,180327,tt1667889,101000000,172000000,1.72E+08,7.63E+08,9.35E+08,1.066255,1.066255,"Manny, Diego, and Sid embark upon another adventure after their continent is set adrift. Using an iceberg as a ship, they encounter sea creatures and battle pirates as they explore a new world.",3,TRUE,TRUE,TRUE,TRUE,FALSE,TRUE,FALSE,TRUE,TRUE,TRUE,TRUE,TRUE,TRUE,TRUE,TRUE,TRUE,TRUE,TRUE,TRUE,TRUE,TRUE,TRUE,TRUE,TRUE,-12,-3,-1,-0.3,-29705,-99999996,-218999960,-5.00E+06,-985999756,"(6.7,7.5]","(5.9,6.7]","(2e+08,3e+08]","(1e+08,2e+08]",1108,1.00E+08,4
Ice Age,Ice Age: Continental Drift,2012,7/13/12,PG,88,FALSE,TRUE,FALSE,FALSE,FALSE,TRUE,TRUE,FALSE,FALSE,FALSE,TRUE,TRUE,FALSE,FALSE,TRUE,FALSE,FALSE,FALSE,FALSE,FALSE,English,TRUE,USA,TRUE,2 wins & 11 nominations.,2,11,6.6,49,37,180327,tt1667889,172000000,1.72E+08,7.63E+08,9.35E+08,1.066255,1.066255,"Manny, Diego, and Sid embark upon another adventure after their continent is set adrift. Using an iceberg as a ship, they encounter sea creatures and battle pirates as they explore a new world.",Ice Age: Collision Course,2016,7/22/16,PG,94,FALSE,TRUE,FALSE,FALSE,FALSE,FALSE,TRUE,FALSE,TRUE,FALSE,TRUE,TRUE,FALSE,TRUE,TRUE,FALSE,FALSE,FALSE,FALSE,FALSE,English,TRUE,USA,TRUE,2 wins.,2,0,5.7,34,18,51146,tt3416828,105000000,64063008,,344516030,408579038,,,"When Scrat's acorn sends an asteroid to Earth, the Herd must find a way to stop the asteroid from hitting Earth with the help of a returning friend.",4,TRUE,TRUE,TRUE,TRUE,FALSE,TRUE,TRUE,TRUE,FALSE,TRUE,TRUE,TRUE,TRUE,TRUE,TRUE,TRUE,TRUE,TRUE,TRUE,TRUE,TRUE,TRUE,TRUE,TRUE,-1,-3,-15,-0.9,-129181,-100999999,-171999999,,-934999999,"(5.9,6.7]","(5.1,5.9]","(1e+08,2e+08]","(0,1e+08]",1470,1.01E+08,5
Indiana Jones,Raiders of the Lost Ark,1981,6/12/81,PG,115,TRUE,TRUE,FALSE,FALSE,FALSE,FALSE,FALSE,FALSE,FALSE,FALSE,FALSE,FALSE,FALSE,FALSE,FALSE,FALSE,FALSE,FALSE,FALSE,FALSE,"English, German, Hebrew, Spanish, Arabic, Nepali",TRUE,USA,TRUE,Won 4 Oscars. Another 30 wins & 23 nominations.,30,23,8.4,85,95,832295,tt0082971,641000000,7.50E+08,4.28E+08,1.18E+09,3.020821,2.960882,"In 1936, archaeologist and adventurer Indiana Jones is hired by the U.S. government to find the Ark of the Covenant before Adolf Hitler's Nazis can obtain its deadly powers.",Indiana Jones and the Temple of Doom,1984,5/23/84,PG,118,TRUE,TRUE,FALSE,FALSE,FALSE,FALSE,FALSE,FALSE,FALSE,FALSE,FALSE,FALSE,FALSE,FALSE,FALSE,FALSE,FALSE,FALSE,FALSE,FALSE,"English, Sinhalese, Hindi",TRUE,USA,TRUE,Won 1 Oscar. Another 10 wins & 21 nominations.,10,21,7.6,57,85,417581,tt0087469,69166667,444000000,4.44E+08,3.79E+08,8.23E+08,2.470238,2.470238,"In 1935, Indiana Jones arrives in India, still part of the British Empire, and is asked to find a mystical stone. He then stumbles upon a secret cult committing enslavement and human sacrifices in the catacombs of an ancient palace.",3,TRUE,TRUE,TRUE,TRUE,TRUE,TRUE,TRUE,TRUE,TRUE,TRUE,TRUE,TRUE,TRUE,TRUE,TRUE,TRUE,TRUE,TRUE,TRUE,TRUE,FALSE,TRUE,TRUE,TRUE,-25,0,-28,-0.8,-414714,-54374615,-640999840,-4.90E+07,-1179999771,"(7.5,10]","(7.5,10]","(4e+08,1e+10]","(4e+08,1e+10]",1076,54374774,2
Indiana Jones,Indiana Jones and the Temple of Doom,1984,5/23/84,PG,118,TRUE,TRUE,FALSE,FALSE,FALSE,FALSE,FALSE,FALSE,FALSE,FALSE,FALSE,FALSE,FALSE,FALSE,FALSE,FALSE,FALSE,FALSE,FALSE,FALSE,"English, Sinhalese, Hindi",TRUE,USA,TRUE,Won 1 Oscar. Another 10 wins & 21 nominations.,10,21,7.6,57,85,417581,tt0087469,444000000,4.44E+08,3.79E+08,8.23E+08,2.470238,2.470238,"In 1935, Indiana Jones arrives in India, still part of the British Empire, and is asked to find a mystical stone. He then stumbles upon a secret cult committing enslavement and human sacrifices in the catacombs of an ancient palace.",Indiana Jones and the Last Crusade,1989,5/24/89,PG-13,127,TRUE,TRUE,FALSE,FALSE,FALSE,FALSE,FALSE,FALSE,FALSE,FALSE,FALSE,FALSE,FALSE,FALSE,FALSE,FALSE,FALSE,FALSE,FALSE,FALSE,"English, German, Greek, Arabic",TRUE,USA,TRUE,Won 1 Oscar. Another 7 wins & 22 nominations.,7,22,8.2,65,88,650678,tt0097576,99849627,410000000,4.10E+08,5.76E+08,9.86E+08,2.080201,2.080201,"In 1938, after his father Professor Henry Jones, Sr. goes missing while pursuing the Holy Grail, Professor Henry """"""""Indiana"""""""" Jones, Jr. finds himself up against Adolf Hitler's Nazis again to stop them from obtaining its powers.",5,FALSE,TRUE,TRUE,TRUE,TRUE,TRUE,TRUE,TRUE,TRUE,TRUE,TRUE,TRUE,TRUE,TRUE,TRUE,TRUE,TRUE,TRUE,TRUE,TRUE,FALSE,TRUE,TRUE,TRUE,32,3,8,0.6,233097,-69166481,-443999845,1.97E+08,-822999752,"(7.5,10]","(7.5,10]","(4e+08,1e+10]","(4e+08,1e+10]",1827,69166667,3
Indiana Jones,Indiana Jones and the Last Crusade,1989,5/24/89,PG-13,127,TRUE,TRUE,FALSE,FALSE,FALSE,FALSE,FALSE,FALSE,FALSE,FALSE,FALSE,FALSE,FALSE,FALSE,FALSE,FALSE,FALSE,FALSE,FALSE,FALSE,"English, German, Greek, Arabic",TRUE,USA,TRUE,Won 1 Oscar. Another 7 wins & 22 nominations.,7,22,8.2,65,88,650678,tt0097576,410000000,4.10E+08,5.76E+08,9.86E+08,2.080201,2.080201,"In 1938, after his father Professor Henry Jones, Sr. goes missing while pursuing the Holy Grail, Professor Henry """"""""Indiana"""""""" Jones, Jr. finds himself up against Adolf Hitler's Nazis again to stop them from obtaining its powers.",Indiana Jones and the Kingdom of the Crystal Skull,2008,5/22/08,PG-13,122,TRUE,TRUE,FALSE,FALSE,FALSE,FALSE,FALSE,FALSE,FALSE,FALSE,FALSE,FALSE,FALSE,FALSE,FALSE,FALSE,FALSE,FALSE,FALSE,FALSE,"English, German, Russian",TRUE,USA,TRUE,Nominated for 1 BAFTA Film Award. Another 10 wins & 41 nominations.,10,41,6.1,65,78,402081,tt0367882,214000000,367000000,3.67E+08,5.43E+08,9.09E+08,1.155989,1.155989,"In 1957, archaeologist and adventurer Dr. Henry """"""""Indiana"""""""" Jones, Jr. is called back into action and becomes entangled in a Soviet plot to uncover the secret behind mysterious artifacts known as the Crystal Skulls.",19,TRUE,TRUE,TRUE,TRUE,TRUE,TRUE,TRUE,TRUE,TRUE,TRUE,TRUE,TRUE,TRUE,TRUE,TRUE,TRUE,TRUE,TRUE,TRUE,TRUE,FALSE,TRUE,TRUE,TRUE,-41,19,0,-2.1,-248597,-99849549,-409999870,-3.30E+07,-985999759,"(7.5,10]","(5.9,6.7]","(4e+08,1e+10]","(3e+08,4e+08]",6938,99849627,4
Iron Man,Iron Man,2008,5/2/08,PG-13,126,TRUE,TRUE,FALSE,FALSE,FALSE,FALSE,FALSE,FALSE,TRUE,FALSE,FALSE,FALSE,FALSE,FALSE,FALSE,FALSE,FALSE,FALSE,FALSE,FALSE,"Hungarian, Kurdish, Hindi, English, Persian, Urdu, Arabic",TRUE,USA,TRUE,Nominated for 2 Oscars. Another 20 wins & 65 nominations.,20,65,7.9,79,94,889014,tt0371746,368000000,3.68E+08,3.08E+08,6.76E+08,1.155954,1.155954,"After being held captive in an Afghan cave, billionaire engineer Tony Stark creates a unique weaponized suit of armor to fight evil.",Iron Man 2,2010,5/7/10,PG-13,124,TRUE,TRUE,FALSE,FALSE,FALSE,FALSE,FALSE,FALSE,TRUE,FALSE,FALSE,FALSE,FALSE,FALSE,FALSE,FALSE,FALSE,FALSE,FALSE,FALSE,"English, French, Russian",TRUE,USA,TRUE,Nominated for 1 Oscar. Another 7 wins & 42 nominations.,7,42,7,57,73,679191,tt1228705,209000000,326000000,3.26E+08,3.25E+08,6.51E+08,1.044025,1.044025,"With the world now aware of his identity as Iron Man, Tony Stark must contend with both his declining health and a vengeful mad man with ties to his father's legacy.",2,TRUE,TRUE,TRUE,TRUE,TRUE,TRUE,TRUE,TRUE,TRUE,TRUE,TRUE,TRUE,TRUE,TRUE,TRUE,TRUE,TRUE,TRUE,TRUE,TRUE,FALSE,TRUE,TRUE,TRUE,18,-18,-22,-0.9,-209823,-161999924,-367999878,1.70E+07,-675999808,"(7.5,10]","(6.7,7.5]","(3e+08,4e+08]","(3e+08,4e+08]",735,1.62E+08,2
Iron Man,Iron Man 2,2010,5/7/10,PG-13,124,TRUE,TRUE,FALSE,FALSE,FALSE,FALSE,FALSE,FALSE,TRUE,FALSE,FALSE,FALSE,FALSE,FALSE,FALSE,FALSE,FALSE,FALSE,FALSE,FALSE,"English, French, Russian",TRUE,USA,TRUE,Nominated for 1 Oscar. Another 7 wins & 42 nominations.,7,42,7,57,73,679191,tt1228705,326000000,3.26E+08,3.25E+08,6.51E+08,1.044025,1.044025,"With the world now aware of his identity as Iron Man, Tony Stark must contend with both his declining health and a vengeful mad man with ties to his father's legacy.",Iron Man 3,2013,5/3/13,PG-13,130,TRUE,TRUE,FALSE,FALSE,FALSE,FALSE,FALSE,FALSE,TRUE,FALSE,FALSE,FALSE,FALSE,FALSE,FALSE,FALSE,FALSE,FALSE,FALSE,FALSE,English,TRUE,USA,TRUE,Nominated for 1 Oscar. Another 17 wins & 61 nominations.,17,61,7.2,62,79,713364,tt1300854,198000000,405000000,4.05E+08,7.99E+08,1.20E+09,0.990453,0.990453,"When Tony Stark's world is torn apart by a formidable terrorist called the Mandarin, he starts an odyssey of rebuilding and retribution.",3,TRUE,TRUE,TRUE,TRUE,TRUE,TRUE,TRUE,TRUE,TRUE,TRUE,TRUE,TRUE,TRUE,TRUE,TRUE,TRUE,TRUE,TRUE,TRUE,TRUE,FALSE,TRUE,TRUE,TRUE,-32,17,5,0.2,34173,-208999942,-325999847,4.74E+08,-650999974,"(6.7,7.5]","(6.7,7.5]","(3e+08,4e+08]","(4e+08,1e+10]",1092,2.09E+08,3
Jackass,Jackass: The Movie,2002,10/25/02,R,87,TRUE,FALSE,FALSE,TRUE,FALSE,FALSE,FALSE,FALSE,FALSE,FALSE,TRUE,FALSE,FALSE,FALSE,FALSE,FALSE,FALSE,FALSE,FALSE,FALSE,English,TRUE,USA,TRUE,1 win & 7 nominations.,1,7,6.6,42,49,77404,tt0322802,91777300,91777300,21765518,1.14E+08,1.428322,1.428322,Johnny Knoxville and his band of maniacs perform a variety of stunts and gross-out gags on the big screen for the first time.,Jackass Number Two,2006,9/22/06,R,92,TRUE,FALSE,FALSE,TRUE,FALSE,FALSE,FALSE,FALSE,FALSE,FALSE,TRUE,FALSE,FALSE,FALSE,FALSE,FALSE,FALSE,FALSE,FALSE,FALSE,English,TRUE,USA,TRUE,1 nomination.,0,1,7,66,64,63488,tt0493430,14572518,92223400,92223400,15003130,1.07E+08,1.267175,1.267175,"Chris Pontius, Johnny Knoxville, Steve-O, Bam Margera, and the whole crew return to the screen to raise the stakes higher than ever before.",4,TRUE,TRUE,TRUE,TRUE,TRUE,TRUE,TRUE,TRUE,TRUE,TRUE,TRUE,TRUE,TRUE,TRUE,TRUE,TRUE,TRUE,TRUE,TRUE,TRUE,TRUE,TRUE,TRUE,TRUE,-1,-58,24,0.4,-13916,-7141545,-91777051,-6762388,-113999989,"(5.9,6.7]","(6.7,7.5]","(0,1e+08]","(0,1e+08]",1428,7141612,2
Jackass,Jackass Number Two,2006,9/22/06,R,92,TRUE,FALSE,FALSE,TRUE,FALSE,FALSE,FALSE,FALSE,FALSE,FALSE,TRUE,FALSE,FALSE,FALSE,FALSE,FALSE,FALSE,FALSE,FALSE,FALSE,English,TRUE,USA,TRUE,1 nomination.,0,1,7,66,64,63488,tt0493430,92223400,92223400,15003130,1.07E+08,1.267175,1.267175,"Chris Pontius, Johnny Knoxville, Steve-O, Bam Margera, and the whole crew return to the screen to raise the stakes higher than ever before.",Jackass 3D,2010,10/15/10,R,94,TRUE,FALSE,FALSE,TRUE,FALSE,FALSE,FALSE,FALSE,FALSE,FALSE,TRUE,FALSE,FALSE,FALSE,FALSE,FALSE,FALSE,FALSE,FALSE,FALSE,English,TRUE,USA,TRUE,1 win & 4 nominations.,1,4,7,56,65,54014,tt1116184,20724101,121000000,1.21E+08,56427686,1.78E+08,1.036205,1.036205,"Johnny Knoxville and company return for the third installment of their TV show spin-off, where dangerous stunts and explicit public displays rule.",4,TRUE,TRUE,TRUE,TRUE,TRUE,TRUE,TRUE,TRUE,TRUE,TRUE,TRUE,TRUE,TRUE,TRUE,TRUE,TRUE,TRUE,TRUE,TRUE,TRUE,TRUE,TRUE,TRUE,TRUE,1,35,-10,0,-9474,-14572423,-92223387,41424556,-106999938,"(6.7,7.5]","(6.7,7.5]","(0,1e+08]","(1e+08,2e+08]",1484,14572518,3
James Bond,On Her Majesty's Secret Service,1969,12/19/69,PG,142,TRUE,TRUE,TRUE,FALSE,FALSE,FALSE,FALSE,FALSE,FALSE,FALSE,FALSE,FALSE,FALSE,FALSE,FALSE,FALSE,FALSE,FALSE,FALSE,FALSE,"English, German, French",TRUE,UK,FALSE,Nominated for 1 Golden Globe. Another 1 win & 3 nominations.,1,3,6.7,61,82,73231,tt0064757,133000000,1.33E+08,1.33E+08,1.33E+08,5.84507,5.84507,James Bond woos a mob boss' daughter and goes undercover to uncover the true reason for Blofeld's allergy research in the Swiss Alps that involves beautiful women from around the world.,Diamonds Are Forever,1971,12/17/71,PG,120,TRUE,TRUE,TRUE,FALSE,FALSE,FALSE,FALSE,FALSE,FALSE,FALSE,FALSE,FALSE,FALSE,FALSE,FALSE,FALSE,FALSE,FALSE,FALSE,FALSE,"English, German",TRUE,UK,FALSE,Nominated for 1 Oscar. Another 2 wins & 3 nominations.,2,3,6.6,59,65,88725,tt0066995,-999,220000000,2.20E+08,2.20E+08,2.20E+08,5.030303,5.030303,"A diamond smuggling investigation leads James Bond to Las Vegas, where he uncovers an evil plot involving a rich business tycoon.",2,TRUE,TRUE,TRUE,TRUE,TRUE,TRUE,TRUE,TRUE,TRUE,TRUE,TRUE,TRUE,TRUE,TRUE,TRUE,TRUE,TRUE,TRUE,TRUE,TRUE,FALSE,TRUE,TRUE,TRUE,13,0,-2,-0.1,15494,1001,-132999921,8.70E+07,-132999915,"(5.9,6.7]","(5.9,6.7]","(1e+08,2e+08]","(2e+08,3e+08]",728,-999,2
